puzzleid,date_posted,title,author,difficulty,players_solved,mean_sol_len,mode_sol_len,min_sol_len,likes,dislikes,datetime_posted,year,month,day,yearindays,monthindays,day_posted
12796,3/31/2020 8:30:11 PM,XOR Lines,scorpio,3,3,19,20,17,2,0,2020-03-31 20:30:11,12,3,31,4382,60,4473
12795,3/31/2020 12:06:12 PM,Bushnell's Law,axorion,3.8,6,29.3333333333,0,25,5,0,2020-03-31 12:06:12,12,3,31,4382,60,4473
12794,3/30/2020 3:03:31 PM,Test,MrMartin,1.75,12,9.166666667,8,6,4,1,2020-03-30 15:03:31,12,3,30,4382,60,4472
12793,3/27/2020 3:28:42 PM,tbh i dont know???,LACav,1.86,12,23.5,14,14,4,1,2020-03-27 15:28:42,12,3,27,4382,60,4469
12792,3/27/2020 12:21:23 PM,Just Halfs,drmazhar,3.2,7,15.7142857143,16,15,5,0,2020-03-27 12:21:23,12,3,27,4382,60,4469
12789,3/27/2020 12:35:09 AM,Nighthawk,scorpio,4,3,17.3333333333,18,16,2,0,2020-03-27 00:35:09,12,3,27,4382,60,4469
12788,3/26/2020 9:37:07 AM,Pop At Green,drmazhar,3,3,22,0,19,1,0,2020-03-26 09:37:07,12,3,26,4382,60,4468
12787,3/25/2020 4:33:59 PM,1998,axorion,3,2,17.5,0,17,1,0,2020-03-25 16:33:59,12,3,25,4382,60,4467
12786,3/24/2020 7:52:55 AM,taiwan is not chinese,jimmyfu,1.11,17,14.588235294,13,13,2,1,2020-03-24 07:52:55,12,3,24,4382,60,4466
12785,3/22/2020 7:09:59 PM,Antclockwise spiral,drmazhar,3.5,5,12,12,12,2,0,2020-03-22 19:09:59,12,3,22,4382,60,4464
12784,3/22/2020 12:39:28 PM,Corona Dispersion Algorithm,drmazhar,2,7,15.4285714286,15,14,2,0,2020-03-22 12:39:28,12,3,22,4382,60,4464
12783,3/21/2020 6:55:04 PM,Distance or Direction,drmazhar,2.75,8,9,9,9,2,0,2020-03-21 18:55:04,12,3,21,4382,60,4463
12782,3/20/2020 2:59:10 AM,Heavy Dumbbell III,drmazhar,2.5,3,21.6666666667,22,21,1,0,2020-03-20 02:59:10,12,3,20,4382,60,4462
12781,3/19/2020 4:40:43 PM,Monochromatic Sandglass,scorpio,3.67,5,17.6,17,16,3,0,2020-03-19 16:40:43,12,3,19,4382,60,4461
12780,3/19/2020 2:26:12 AM,Sandglass,scorpio,2.75,7,12.1428571429,12,11,4,0,2020-03-19 02:26:12,12,3,19,4382,60,4461
12779,3/18/2020 3:26:11 PM,Light Dumbbell,scorpio,3.67,6,19.5,19,16,3,0,2020-03-18 15:26:11,12,3,18,4382,60,4460
12778,3/18/2020 1:18:53 PM,Circular Road includes Many Crosses,drmazhar,2.5,5,16.2,13,13,3,0,2020-03-18 13:18:53,12,3,18,4382,60,4460
12777,3/17/2020 5:19:52 PM,Coming Up Short,axorion,3.5,3,14,14,14,1,0,2020-03-17 17:19:52,12,3,17,4382,60,4459
12776,3/17/2020 4:58:49 PM,Heavy Dumbbell II,drmazhar,3,3,30.3333333333,32,27,1,0,2020-03-17 16:58:49,12,3,17,4382,60,4459
12775,3/17/2020 4:29:37 PM,Over The Top,axorion,3.33,6,11,11,11,3,0,2020-03-17 16:29:37,12,3,17,4382,60,4459
12774,3/17/2020 10:22:32 AM,Double recursion,goshal,2.6,10,13,11,10,5,0,2020-03-17 10:22:32,12,3,17,4382,60,4459
12773,3/16/2020 9:11:38 PM,Midpoint,goshal,2,13,6,6,6,2,0,2020-03-16 21:11:38,12,3,16,4382,60,4458
12772,3/16/2020 6:15:33 AM,level 1,Casualuser,1,45,5,5,5,12,1,2020-03-16 06:15:33,12,3,16,4382,60,4458
12771,3/15/2020 10:32:45 PM,Arrowhead,scorpio,3.5,3,18,19,16,2,0,2020-03-15 22:32:45,12,3,15,4382,60,4457
12770,3/15/2020 8:33:04 AM,Red & Greens,drmazhar,2.4,8,17.5,0,15,3,0,2020-03-15 08:33:04,12,3,15,4382,60,4457
12769,3/14/2020 11:59:01 PM,Heavy Dumbbell,scorpio,5,2,20,0,18,1,0,2020-03-14 23:59:01,12,3,14,4382,60,4456
12768,3/13/2020 7:42:28 PM,Red's Condition,drmazhar,3,3,12.33333333,12,12,2,0,2020-03-13 19:42:28,12,3,13,4382,60,4455
12767,3/13/2020 5:25:56 PM,MED,Meddaif99,2,10,26.5,23,14,3,2,2020-03-13 17:25:56,12,3,13,4382,60,4455
12766,3/13/2020 5:24:40 PM,MED,Meddaif99,1.83,11,26.4545454545,23,14,3,2,2020-03-13 17:24:40,12,3,13,4382,60,4455
12765,3/12/2020 10:34:00 AM,STC,adeem69300,1.57,12,17.1666666667,14,13,3,1,2020-03-12 10:34:00,12,3,12,4382,60,4454
12764,3/11/2020 4:02:31 PM,Green Shafted,jnpollack,3,5,16,16,16,1,0,2020-03-11 16:02:31,12,3,11,4382,60,4453
12763,3/11/2020 1:39:03 AM,"Count till Green ""Version 2""",drmazhar,3,8,8,8,8,3,0,2020-03-11 01:39:03,12,3,11,4382,60,4453
12762,3/10/2020 4:03:18 AM,Red Shifted,axorion,3,5,10,10,10,2,0,2020-03-10 04:03:18,12,3,10,4382,60,4452
12761,3/10/2020 2:53:34 AM,Count till Green,drmazhar,2.67,8,8,8,8,5,0,2020-03-10 02:53:34,12,3,10,4382,60,4452
12760,3/9/2020 12:42:52 AM,Shifted reflection,scorpio,3.33,5,10,10,10,3,0,2020-03-09 00:42:52,12,3,9,4382,60,4451
12759,3/8/2020 1:17:28 PM,Balloons...,jnpollack,2.33,6,24.8333333333,25,24,1,0,2020-03-08 13:17:28,12,3,8,4382,60,4450
12758,3/8/2020 1:48:08 AM,Loopy Spiral,jnpollack,3,3,16,16,16,0,0,2020-03-08 01:48:08,12,3,8,4382,60,4450
12756,3/7/2020 2:07:17 PM,Preparations 6,drmazhar,3,9,13.2222222222,13,13,2,0,2020-03-07 14:07:17,12,3,7,4382,60,4449
12755,3/7/2020 10:20:55 AM,Track Switch,jnpollack,3.33,5,11.8,11,10,2,0,2020-03-07 10:20:55,12,3,7,4382,60,4449
12754,3/5/2020 8:46:24 AM,"Odd : 1 Way , Even : 2 Ways",drmazhar,3,3,32.6666666667,0,29,2,0,2020-03-05 08:46:24,12,3,5,4382,60,4447
12753,3/5/2020 1:08:53 AM,Half Then Double,drmazhar,3,6,24.8333333333,25,24,2,0,2020-03-05 01:08:53,12,3,5,4382,60,4447
12752,3/3/2020 12:52:46 PM,8 Conditions,jnpollack,3,3,16.3333333333,17,15,1,0,2020-03-03 12:52:46,12,3,3,4382,60,4445
12751,3/1/2020 4:38:58 AM,Useless Red Tile,jnpollack,2.75,7,19.8571428571,20,19,2,0,2020-03-01 04:38:58,12,3,1,4382,60,4443
12750,2/29/2020 2:24:32 PM,U - Turn,drmazhar,2.25,10,13,13,13,3,0,2020-02-29 14:24:32,12,2,29,4382,31,4442
12749,2/29/2020 7:51:29 AM,First of the Month,GabrielR,2.17,12,7.5,7,7,3,1,2020-02-29 07:51:29,12,2,29,4382,31,4442
12748,2/29/2020 7:06:54 AM,Stack with Green,drmazhar,2.4,9,10,10,10,2,0,2020-02-29 07:06:54,12,2,29,4382,31,4442
12747,2/28/2020 2:35:20 PM,Empty Nest,jnpollack,2.83,10,9,9,9,4,0,2020-02-28 14:35:20,12,2,28,4382,31,4441
12746,2/27/2020 7:31:57 PM,Skeptic Tank,jnpollack,3,7,16.4285714286,16,16,3,0,2020-02-27 19:31:57,12,2,27,4382,31,4440
12745,2/27/2020 4:19:37 PM,Reverse then U turn,drmazhar,2,17,11,11,11,8,0,2020-02-27 16:19:37,12,2,27,4382,31,4440
12744,2/26/2020 11:11:33 PM,Put Signs For your Ways (Version 22),drmazhar,3,6,16.8333333333,0,14,1,0,2020-02-26 23:11:33,12,2,26,4382,31,4439
12743,2/26/2020 1:36:46 AM,Hidden stack,scorpio,3,5,14.2,14,14,4,0,2020-02-26 01:36:46,12,2,26,4382,31,4439
12742,2/23/2020 5:27:11 PM,Instruction (Version 3),drmazhar,3,4,10.5,0,9,1,0,2020-02-23 17:27:11,12,2,23,4382,31,4436
12741,2/21/2020 10:18:58 AM,Simpler Than It Looks,jnpollack,3,4,23,23,22,1,0,2020-02-21 10:18:58,12,2,21,4382,31,4434
12740,2/18/2020 8:42:43 PM,@-Cyclin,scorpio,3,2,18.5,0,16,1,0,2020-02-18 20:42:43,12,2,18,4382,31,4431
12739,2/18/2020 3:40:08 AM,Empty Stacks,jnpollack,2.33,4,20,0,17,1,0,2020-02-18 03:40:08,12,2,18,4382,31,4431
12738,2/16/2020 5:55:44 PM,Put Signs For your Ways (Version 21),drmazhar,2,4,13,13,13,1,0,2020-02-16 17:55:44,12,2,16,4382,31,4429
12737,2/16/2020 5:40:29 PM,Super Postion (Quantum Physics),drmazhar,2,2,18,18,18,0,0,2020-02-16 17:40:29,12,2,16,4382,31,4429
12736,2/14/2020 8:22:18 AM,Music Bass,kiraro,2.25,14,13.2142857143,13,13,6,1,2020-02-14 08:22:18,12,2,14,4382,31,4427
12735,2/13/2020 10:22:48 PM,Phoenix,scorpio,3.33,5,16.2,15,15,3,0,2020-02-13 22:22:48,12,2,13,4382,31,4426
12734,2/13/2020 5:51:02 PM,An Even Puzzle,jnpollack,3.5,5,18.4,18,17,3,0,2020-02-13 17:51:02,12,2,13,4382,31,4426
12733,2/12/2020 5:11:36 PM,An Odd Puzzle,jnpollack,4,2,30,30,30,0,0,2020-02-12 17:11:36,12,2,12,4382,31,4425
12732,2/11/2020 4:18:55 PM,The Green Divide,jnpollack,3,4,15,15,15,2,0,2020-02-11 16:18:55,12,2,11,4382,31,4424
12731,2/11/2020 3:55:52 PM,The Red Divide,jnpollack,3,2,14.5,0,14,0,0,2020-02-11 15:55:52,12,2,11,4382,31,4424
12730,2/10/2020 2:11:49 PM,Castle,hanness,1.57,22,8.5909090909,7,7,5,0,2020-02-10 14:11:49,12,2,10,4382,31,4423
12728,2/10/2020 8:29:08 AM,Signs,drmazhar,3,7,13.4285714286,14,11,3,0,2020-02-10 08:29:08,12,2,10,4382,31,4423
12727,2/9/2020 1:38:24 PM,What the hack?,kraker,1.88,23,7.2608695652,6,5,8,0,2020-02-09 13:38:24,12,2,9,4382,31,4422
12726,2/9/2020 5:44:30 AM,Letter T,hanness,1.33,25,7.04,6,6,5,0,2020-02-09 05:44:30,12,2,9,4382,31,4422
12725,2/8/2020 4:42:36 PM,Plus,Toast_,1.33,24,6.125,6,6,4,1,2020-02-08 16:42:36,12,2,8,4382,31,4421
12724,2/8/2020 3:58:56 PM,4_Square,Toast_,1.7,16,7,7,7,5,1,2020-02-08 15:58:56,12,2,8,4382,31,4421
12723,2/8/2020 12:52:53 PM,Checkerboard,Toast_,1.57,17,15.9411764706,15,13,2,0,2020-02-08 12:52:53,12,2,8,4382,31,4421
12722,2/8/2020 11:25:01 AM,Cross 2,Toast_,1.88,13,4.3076923077,4,4,4,1,2020-02-08 11:25:01,12,2,8,4382,31,4421
12721,2/8/2020 3:16:27 AM,Stack with early turning warning,scorpio,4,3,11.3333333333,11,11,2,0,2020-02-08 03:16:27,12,2,8,4382,31,4421
12720,2/7/2020 11:33:52 PM,Cross,Toast_,1.8,11,5,5,5,3,0,2020-02-07 23:33:52,12,2,7,4382,31,4420
12717,2/6/2020 12:34:00 PM,Archimedean Spiral II,jnpollack,3.5,6,19.5,20,18,3,0,2020-02-06 12:34:00,12,2,6,4382,31,4419
12715,2/5/2020 12:43:38 PM,Another Speed Control 8,drmazhar,3,4,14,14,12,0,0,2020-02-05 12:43:38,12,2,5,4382,31,4418
12714,2/4/2020 3:48:26 PM,Convergence II,jnpollack,2,5,8,8,8,0,0,2020-02-04 15:48:26,12,2,4,4382,31,4417
12713,2/4/2020 9:29:06 AM,Platform Descent,jnpollack,2.83,10,21.9,22,21,4,0,2020-02-04 09:29:06,12,2,4,4382,31,4417
12712,2/2/2020 9:59:10 AM,Up And Down,kiusle,1.31,31,4,4,4,7,2,2020-02-02 09:59:10,12,2,2,4382,31,4415
12711,2/2/2020 9:52:51 AM,Inverted T - 2 functions,bobbywankenobi,1.67,22,7,7,7,5,1,2020-02-02 09:52:51,12,2,2,4382,31,4415
12710,2/2/2020 9:47:48 AM,Mr. T,bobbywankenobi,1.67,20,6,6,6,4,0,2020-02-02 09:47:48,12,2,2,4382,31,4415
12709,2/2/2020 9:43:18 AM,Climb the pyramid,bobbywankenobi,1.56,25,5,5,5,6,0,2020-02-02 09:43:18,12,2,2,4382,31,4415
12708,2/2/2020 9:37:14 AM,Two Sides,kiusle,1.14,49,5,5,5,8,1,2020-02-02 09:37:14,12,2,2,4382,31,4415
12707,2/2/2020 9:33:26 AM,Cross without endings.,bobbywankenobi,1.67,21,8,8,8,4,0,2020-02-02 09:33:26,12,2,2,4382,31,4415
12706,2/2/2020 9:31:19 AM,What a biatch!,bobbywankenobi,2,16,7.4375,8,6,5,0,2020-02-02 09:31:19,12,2,2,4382,31,4415
12705,2/2/2020 9:17:57 AM,Spiral,kiusle,1.33,29,4,4,4,4,1,2020-02-02 09:17:57,12,2,2,4382,31,4415
12704,2/1/2020 5:17:39 PM,Dropping the ball,drmazhar,3,4,18,18,18,0,0,2020-02-01 17:17:39,12,2,1,4382,31,4414
12703,2/1/2020 4:36:15 PM,Linked Rectangles (Version 2),drmazhar,3,2,24,0,23,0,0,2020-02-01 16:36:15,12,2,1,4382,31,4414
12702,2/1/2020 4:14:33 PM,Linked Rectangles,drmazhar,3,5,18,18,18,2,0,2020-02-01 16:14:33,12,2,1,4382,31,4414
12701,2/1/2020 3:09:10 AM,Can you count? II,jnpollack,3,3,11.6666666667,12,11,1,0,2020-02-01 03:09:10,12,2,1,4382,31,4414
12700,1/30/2020 11:58:39 AM,Derpy Donut,setnado,2.5,6,12.1666666667,12,11,1,0,2020-01-30 11:58:39,12,1,30,4382,0,4412
12699,1/28/2020 9:43:29 PM,Night reflection in the water,scorpio,3,3,16.3333333333,17,15,2,0,2020-01-28 21:43:29,12,1,28,4382,0,4410
12698,1/28/2020 8:15:41 PM,Zero Stack (Version 5),drmazhar,2.25,7,14,14,14,3,0,2020-01-28 20:15:41,12,1,28,4382,0,4410
12697,1/28/2020 11:14:26 AM,Super Esey,Kostosso,1.25,33,4,4,4,6,1,2020-01-28 11:14:26,12,1,28,4382,0,4410
12696,1/27/2020 4:27:18 PM,After Greens,drmazhar,3,3,16,0,14,2,0,2020-01-27 16:27:18,12,1,27,4382,0,4409
12694,1/26/2020 3:09:58 PM,Imposter Syndrome,jnpollack,3.25,7,13,13,13,4,0,2020-01-26 15:09:58,12,1,26,4382,0,4408
12693,1/24/2020 5:28:59 PM,Foundations,jnpollack,3,4,20.25,22,17,2,0,2020-01-24 17:28:59,12,1,24,4382,0,4406
12692,1/23/2020 7:45:21 PM,Prime Command Layout,setnado,3,3,16.3333333333,17,15,1,0,2020-01-23 19:45:21,12,1,23,4382,0,4405
12691,1/23/2020 1:50:19 AM,Remove Signs for your Ways,drmazhar,3,2,24.5,0,23,1,0,2020-01-23 01:50:19,12,1,23,4382,0,4405
12690,1/22/2020 2:48:59 AM,"RGB,BRB,RGB,RBG,R",drmazhar,2.5,3,9.3333333333,9,9,1,0,2020-01-22 02:48:59,12,1,22,4382,0,4404
12689,1/21/2020 9:29:33 AM,A few stars,kserikba,2.67,4,14.75,14,14,2,0,2020-01-21 09:29:33,12,1,21,4382,0,4403
12688,1/19/2020 11:13:07 AM,easy,sem8,1.29,24,6.8333333333,7,6,4,1,2020-01-19 11:13:07,12,1,19,4382,0,4401
12687,1/18/2020 10:21:22 AM,Hiiii!!,ajayjha25,1.43,21,7.9523809524,8,7,4,2,2020-01-18 10:21:22,12,1,18,4382,0,4400
12686,1/18/2020 8:45:36 AM,s,sem8,3.13,11,7,7,7,5,1,2020-01-18 08:45:36,12,1,18,4382,0,4400
12685,1/18/2020 7:14:41 AM,Another speed control 7,drmazhar,3,4,23.5,0,22,1,0,2020-01-18 07:14:41,12,1,18,4382,0,4400
12684,1/17/2020 11:44:48 PM,Center Cut,jnpollack,2.86,8,14,14,14,6,0,2020-01-17 23:44:48,12,1,17,4382,0,4399
12683,1/17/2020 9:30:19 PM,Fixed Pinwheel,scorpio,4,8,14.375,14,13,4,0,2020-01-17 21:30:19,12,1,17,4382,0,4399
12682,1/17/2020 4:43:34 PM,Reflection + Greens Amplification,drmazhar,3,2,27,0,25,0,0,2020-01-17 16:43:34,12,1,17,4382,0,4399
12681,1/17/2020 12:49:05 PM,Simple Function,Chirector,1.5,19,10.1052631579,10,8,4,1,2020-01-17 12:49:05,12,1,17,4382,0,4399
12680,1/17/2020 11:37:00 AM,Broken Pinwheel,jnpollack,3.13,11,12.9090909091,13,12,7,0,2020-01-17 11:37:00,12,1,17,4382,0,4399
12679,1/17/2020 9:06:07 AM,easy level,sem8,1.86,15,8,8,8,3,0,2020-01-17 09:06:07,12,1,17,4382,0,4399
12678,1/17/2020 9:02:11 AM,Something,sem8,2.29,14,9.4285714286,9,9,4,0,2020-01-17 09:02:11,12,1,17,4382,0,4399
12677,1/16/2020 5:13:03 PM,Orderly Paint 2,jnpollack,2.6,6,7,7,7,4,0,2020-01-16 17:13:03,12,1,16,4382,0,4398
12676,1/13/2020 9:04:58 PM,Reverse Order,drmazhar,3.33,4,26.25,0,22,2,0,2020-01-13 21:04:58,12,1,13,4382,0,4395
12675,1/13/2020 4:42:04 PM,Flower Field,scorpio,3.67,4,18.25,17,17,3,0,2020-01-13 16:42:04,12,1,13,4382,0,4395
12674,1/12/2020 12:55:35 PM,Blue Offset Books,jnpollack,2.75,5,23,23,23,4,0,2020-01-12 12:55:35,12,1,12,4382,0,4394
12673,1/12/2020 12:05:08 AM,A Bulky Crawl Spiral,jnpollack,2.57,11,13,13,13,5,0,2020-01-12 00:05:08,12,1,12,4382,0,4394
12672,1/11/2020 7:20:32 PM,Just Count Greens,drmazhar,3,5,16.6,0,14,3,0,2020-01-11 19:20:32,12,1,11,4382,0,4393
12671,1/11/2020 1:37:56 AM,17 < 19,jnpollack,3.33,6,16.6666666667,17,16,5,0,2020-01-11 01:37:56,12,1,11,4382,0,4393
12670,1/11/2020 1:11:13 AM,Reproduced,jnpollack,3.17,9,19,19,19,5,0,2020-01-11 01:11:13,12,1,11,4382,0,4393
12669,1/10/2020 12:35:31 PM,Reproducibility,drmazhar,2,4,19,19,19,2,0,2020-01-10 12:35:31,12,1,10,4382,0,4392
12668,1/9/2020 1:58:16 AM,Branches of Mazhar,jnpollack,4,5,21,21,21,3,0,2020-01-09 01:58:16,12,1,9,4382,0,4391
12667,1/8/2020 11:36:19 PM,Orderly Walk,jnpollack,3,4,8,7,7,2,0,2020-01-08 23:36:19,12,1,8,4382,0,4390
12666,1/6/2020 7:15:07 PM,With Ease,setnado,2.6,6,11,11,11,4,0,2020-01-06 19:15:07,12,1,6,4382,0,4388
12665,1/5/2020 8:01:24 PM,Seen This Before?,jnpollack,3,9,11.6666666667,12,11,4,0,2020-01-05 20:01:24,12,1,5,4382,0,4387
12664,1/5/2020 10:41:51 AM,The best word,kserikba,1.83,11,9.8181818182,10,8,3,1,2020-01-05 10:41:51,12,1,5,4382,0,4387
12663,1/3/2020 1:45:44 PM,Spring 12,drmazhar,3,7,13.8571428571,14,13,4,0,2020-01-03 13:45:44,12,1,3,4382,0,4385
12662,1/3/2020 11:19:45 AM,Copy work,kserikba,2.5,5,24,24,21,3,0,2020-01-03 11:19:45,12,1,3,4382,0,4385
12661,1/3/2020 12:01:10 AM,Origin,drmazhar,4,2,35,0,32,0,0,2020-01-03 00:01:10,12,1,3,4382,0,4385
12660,12/31/2019 1:20:07 PM,New Year Tree 2,scorpio,3.67,4,14.5,15,13,2,0,2019-12-31 13:20:07,11,12,31,4017,334,4382
12659,12/29/2019 10:02:03 PM,Recursive Rehash,jnpollack,3.33,3,14,14,14,2,0,2019-12-29 22:02:03,11,12,29,4017,334,4380
12658,12/27/2019 12:31:05 AM,Discrete Spiral,drmazhar,3,4,13,13,13,1,0,2019-12-27 00:31:05,11,12,27,4017,334,4378
12657,12/25/2019 4:01:36 PM,Special Reflection,drmazhar,3,4,25.5,26,24,0,0,2019-12-25 16:01:36,11,12,25,4017,334,4376
12656,12/25/2019 3:40:49 PM,Conditional Counting,drmazhar,2.5,7,16.7142857143,17,16,5,0,2019-12-25 15:40:49,11,12,25,4017,334,4376
12655,12/25/2019 6:22:07 AM,Dual Path,drmazhar,2.5,9,10.7777777778,11,10,3,0,2019-12-25 06:22:07,11,12,25,4017,334,4376
12654,12/17/2019 4:57:24 PM,Simple Six,jnpollack,2.2,7,6,6,6,3,0,2019-12-17 16:57:24,11,12,17,4017,334,4368
12653,12/14/2019 6:38:23 AM,Not so difficult,kserikba,3,6,14.8333333333,15,13,3,0,2019-12-14 06:38:23,11,12,14,4017,334,4365
12652,12/14/2019 6:01:59 AM,Simple puzzle,kserikba,2.29,22,8.8636363636,8,8,8,0,2019-12-14 06:01:59,11,12,14,4017,334,4365
12651,12/13/2019 5:35:06 PM,Green!,drmazhar,4,3,9.3333333333,9,9,1,0,2019-12-13 17:35:06,11,12,13,4017,334,4364
12650,12/12/2019 4:44:33 PM,Five Fours,drmazhar,3,5,19.8,20,19,1,0,2019-12-12 16:44:33,11,12,12,4017,334,4363
12649,12/9/2019 7:23:57 PM,Put Signs For Your Ways (Version 20),drmazhar,3,6,23.6666666667,25,19,3,0,2019-12-09 19:23:57,11,12,9,4017,334,4360
12648,12/7/2019 12:39:15 PM,Unnormal Points,drmazhar,2.5,6,9,9,9,3,0,2019-12-07 12:39:15,11,12,7,4017,334,4358
12647,12/7/2019 5:29:34 AM,unsolved,tjwjdgjs22,2.25,14,6,6,6,5,0,2019-12-07 05:29:34,11,12,7,4017,334,4358
12646,12/1/2019 7:42:26 PM,Another speed control 6,drmazhar,3,5,18,0,17,1,0,2019-12-01 19:42:26,11,12,1,4017,334,4352
12645,11/30/2019 8:31:26 AM,Direction Control,drmazhar,3.25,5,29.8,33,25,2,0,2019-11-30 08:31:26,11,11,30,4017,304,4351
12644,11/28/2019 1:08:52 PM,Reflection in Information Gahering way,drmazhar,3,4,32.75,35,27,2,0,2019-11-28 13:08:52,11,11,28,4017,304,4349
12643,11/27/2019 8:00:30 PM,Noise Reduction,drmazhar,4,4,35.25,36,31,2,0,2019-11-27 20:00:30,11,11,27,4017,304,4348
12642,11/26/2019 1:34:15 AM,RIGHT,crystalruby,1.86,15,5,5,5,3,1,2019-11-26 01:34:15,11,11,26,4017,304,4347
12641,11/26/2019 1:00:37 AM,here we go again,crystalruby,1.3,32,5.03125,5,5,6,1,2019-11-26 01:00:37,11,11,26,4017,304,4347
12640,11/26/2019 12:34:47 AM,ummmmm,crystalruby,1.4,29,7.5517241379,8,5,5,1,2019-11-26 00:34:47,11,11,26,4017,304,4347
12639,11/26/2019 12:26:29 AM,slove?,crystalruby,2,16,6.5,0,6,3,1,2019-11-26 00:26:29,11,11,26,4017,304,4347
12638,11/23/2019 6:39:56 PM,Counting the Columns,drmazhar,3.33,5,17.8,18,17,3,0,2019-11-23 18:39:56,11,11,23,4017,304,4344
12637,11/22/2019 3:42:13 AM,Turns at squares,drmazhar,3.67,6,15,15,15,2,0,2019-11-22 03:42:13,11,11,22,4017,304,4343
12636,11/21/2019 12:27:58 PM,"To sticky, kraker, and scorpio...",jnpollack,3.5,2,19,19,19,1,0,2019-11-21 12:27:58,11,11,21,4017,304,4342
12635,11/21/2019 2:39:29 AM,Growth the Thickness,drmazhar,3.5,4,30.75,32,28,1,0,2019-11-21 02:39:29,11,11,21,4017,304,4342
12634,11/19/2019 9:58:14 AM,Dog,padre,2.57,11,6,6,6,4,0,2019-11-19 09:58:14,11,11,19,4017,304,4340
12633,11/19/2019 9:01:40 AM,Cross 5,tjwjdgjs22,1.6,32,8,8,8,8,0,2019-11-19 09:01:40,11,11,19,4017,304,4340
12632,11/17/2019 5:31:31 AM,An Address Game,jnpollack,3.75,7,30.2857142857,30,29,3,0,2019-11-17 05:31:31,11,11,17,4017,304,4338
12631,11/17/2019 1:17:58 AM,Keeping the Puzzle Feed Alive,jnpollack,4,4,16.25,16,16,2,0,2019-11-17 01:17:58,11,11,17,4017,304,4338
12630,11/15/2019 10:30:11 AM,3 Rectangles,jnpollack,2.83,10,8,8,8,5,0,2019-11-15 10:30:11,11,11,15,4017,304,4336
12629,11/15/2019 3:53:45 AM,Playing With stacks (Version 4),drmazhar,2.29,15,10.8666666667,11,10,8,0,2019-11-15 03:53:45,11,11,15,4017,304,4336
12628,11/12/2019 9:58:50 AM,pro pro bro bro,artemka1306,1.36,35,4,4,4,7,3,2019-11-12 09:58:50,11,11,12,4017,304,4333
12627,11/11/2019 1:28:54 PM,Spiky Crab,jnpollack,2.57,10,13,13,13,5,0,2019-11-11 13:28:54,11,11,11,4017,304,4332
12626,11/11/2019 12:29:20 PM,Fort Boyard,artemka1306,1.23,46,5.0434782609,5,5,9,3,2019-11-11 12:29:20,11,11,11,4017,304,4332
12625,11/11/2019 9:32:20 AM,Special Case of Reflection (2.1),jnpollack,3.6,6,30,30,30,3,0,2019-11-11 09:32:20,11,11,11,4017,304,4332
12624,11/10/2019 10:00:51 AM,Multi-purpose,drmazhar,3.4,8,9,9,9,4,0,2019-11-10 10:00:51,11,11,10,4017,304,4331
12623,11/8/2019 12:12:34 PM,Playing With stacks (Version 3),drmazhar,3,4,9.25,9,9,2,0,2019-11-08 12:12:34,11,11,8,4017,304,4329
12622,11/7/2019 6:37:36 PM,chess,mor0048,1.31,51,9.7647058824,13,4,10,3,2019-11-07 18:37:36,11,11,7,4017,304,4328
12621,11/7/2019 6:26:46 PM,lvl 1,mor0048,1.33,54,5.9074074074,6,5,10,3,2019-11-07 18:26:46,11,11,7,4017,304,4328
12620,11/7/2019 5:40:51 PM,Crab (Lite edition),scorpio,2.5,10,12.4,12,12,5,0,2019-11-07 17:40:51,11,11,7,4017,304,4328
12619,11/7/2019 12:12:43 AM,4 square,mor0048,1.25,77,7.1168831169,4,4,17,2,2019-11-07 00:12:43,11,11,7,4017,304,4328
12618,11/6/2019 11:56:25 PM,Holiday Lights,jnpollack,2.5,7,17.2857142857,19,15,4,0,2019-11-06 23:56:25,11,11,6,4017,304,4327
12617,11/6/2019 10:16:29 AM,"Es, 3s, and Cs",jnpollack,4,5,18.6,0,17,1,0,2019-11-06 10:16:29,11,11,6,4017,304,4327
12616,11/5/2019 11:22:47 PM,Another Reflection control,drmazhar,3,4,22.5,23,20,2,0,2019-11-05 23:22:47,11,11,5,4017,304,4326
12615,11/5/2019 10:43:19 PM,Donâ€™t Paint Your Puzzle,jnpollack,3,2,22,22,22,0,0,2019-11-05 22:43:19,11,11,5,4017,304,4326
12614,11/5/2019 3:45:54 AM,Crab,scorpio,4,6,14,14,14,4,0,2019-11-05 03:45:54,11,11,5,4017,304,4326
12613,11/2/2019 10:59:53 AM,Lines of Mines,jnpollack,3.67,4,22,23,19,2,0,2019-11-02 10:59:53,11,11,2,4017,304,4323
12612,11/2/2019 4:33:33 AM,Meander,inconight,2,4,8.25,7,7,1,1,2019-11-02 04:33:33,11,11,2,4017,304,4323
12611,11/2/2019 4:07:46 AM,Filter (Version 4),drmazhar,2.75,7,13.1428571429,14,12,4,0,2019-11-02 04:07:46,11,11,2,4017,304,4323
12610,11/1/2019 2:49:46 PM,Not so easy,Sewadius,1.73,24,12.0833333333,7,7,8,2,2019-11-01 14:49:46,11,11,1,4017,304,4322
12609,11/1/2019 9:39:25 AM,Diamond Stack,jnpollack,4,3,16,16,16,1,0,2019-11-01 09:39:25,11,11,1,4017,304,4322
12608,10/31/2019 3:21:12 PM,Get Around 2,jnpollack,3.4,6,12.3333333333,12,12,4,0,2019-10-31 15:21:12,11,10,31,4017,273,4321
12607,10/31/2019 3:33:19 AM,Pumpkin (Halloween special),scorpio,4,4,16,16,16,3,0,2019-10-31 03:33:19,11,10,31,4017,273,4321
12606,10/31/2019 2:00:50 AM,Get Around,jnpollack,3,7,6,6,6,3,0,2019-10-31 02:00:50,11,10,31,4017,273,4321
12605,10/30/2019 9:41:52 AM,Moving Cross,drmazhar,3.25,5,8.6,8,8,2,0,2019-10-30 09:41:52,11,10,30,4017,273,4320
12604,10/29/2019 2:57:28 AM,Checkpoint,MasterLuk,2.83,11,7,7,7,3,0,2019-10-29 02:57:28,11,10,29,4017,273,4319
12603,10/26/2019 2:59:57 PM,Half Life (Version 2),drmazhar,2.75,7,13,13,13,3,0,2019-10-26 14:59:57,11,10,26,4017,273,4316
12602,10/26/2019 6:36:27 AM,X In X,mynwo,2,14,11.7857142857,0,8,4,1,2019-10-26 06:36:27,11,10,26,4017,273,4316
12601,10/24/2019 7:06:29 PM,Zero Stack (Version 3),drmazhar,2.43,12,9,9,9,4,0,2019-10-24 19:06:29,11,10,24,4017,273,4314
12600,10/24/2019 1:51:40 PM,Zero Stack (Version 3),drmazhar,2,13,8.0769230769,9,7,6,0,2019-10-24 13:51:40,11,10,24,4017,273,4314
12599,10/24/2019 11:49:28 AM,2 in 1,kserikba,3,8,12.375,13,11,3,0,2019-10-24 11:49:28,11,10,24,4017,273,4314
12598,10/23/2019 6:40:57 PM,Another Paint Stacker,jnpollack,3,6,17.8333333333,18,15,3,0,2019-10-23 18:40:57,11,10,23,4017,273,4313
12597,10/23/2019 12:15:03 PM,Broken Columns,jnpollack,4,4,21.25,21,21,2,0,2019-10-23 12:15:03,11,10,23,4017,273,4313
12596,10/22/2019 7:10:04 PM,Red Zigs; Green Zags,jnpollack,2.75,6,22,22,21,2,0,2019-10-22 19:10:04,11,10,22,4017,273,4312
12595,10/22/2019 7:16:43 AM,a,drmazhar,2.6,9,16.3333333333,15,14,5,0,2019-10-22 07:16:43,11,10,22,4017,273,4312
12594,10/22/2019 12:45:53 AM,Go forward and back,offreal,1.54,31,8,8,8,8,2,2019-10-22 00:45:53,11,10,22,4017,273,4312
12593,10/20/2019 9:13:14 PM,Tap Your Brakes Lightly II,drmazhar,3.67,4,13,13,13,2,0,2019-10-20 21:13:14,11,10,20,4017,273,4310
12592,10/20/2019 8:48:03 AM,Black Zone,drmazhar,3,3,14.6666666667,15,14,1,0,2019-10-20 08:48:03,11,10,20,4017,273,4310
12591,10/18/2019 8:34:01 PM,Tap Your Brakes Lightly,jnpollack,3.33,5,8,8,8,2,0,2019-10-18 20:34:01,11,10,18,4017,273,4308
12590,10/18/2019 1:48:38 PM,Red Means 4 More,jnpollack,3,2,15,0,14,0,0,2019-10-18 13:48:38,11,10,18,4017,273,4308
12589,10/18/2019 1:16:52 AM,Trick Stack Tutorial,jnpollack,3,2,9,9,9,0,0,2019-10-18 01:16:52,11,10,18,4017,273,4308
12588,10/17/2019 1:26:57 PM,Tap Your Brakes,jnpollack,4.5,3,10,10,10,1,0,2019-10-17 13:26:57,11,10,17,4017,273,4307
12587,10/16/2019 3:11:52 PM,Reflection (Version 9),drmazhar,3,5,28.2,0,23,2,0,2019-10-16 15:11:52,11,10,16,4017,273,4306
12586,10/15/2019 11:01:06 PM,Backup & Restore (Version 9),drmazhar,3,3,12.6666666667,13,12,2,0,2019-10-15 23:01:06,11,10,15,4017,273,4305
12585,10/15/2019 2:24:54 PM,Noob Stack Tutorial,jnpollack,2.5,10,9.7,10,9,5,0,2019-10-15 14:24:54,11,10,15,4017,273,4305
12584,10/15/2019 10:57:35 AM,Tutorial:Part 2,artemka1306,1.25,81,7,7,7,13,3,2019-10-15 10:57:35,11,10,15,4017,273,4305
12583,10/15/2019 10:54:27 AM,Tutorial:Part 1,artemka1306,1.25,116,7.8448275862,8,7,17,3,2019-10-15 10:54:27,11,10,15,4017,273,4305
12582,10/15/2019 10:40:23 AM,It,artemka1306,1.23,50,5.22,5,5,8,2,2019-10-15 10:40:23,11,10,15,4017,273,4305
12581,10/14/2019 1:37:38 PM,candy,artemka1306,1.25,45,6,6,6,7,1,2019-10-14 13:37:38,11,10,14,4017,273,4304
12580,10/13/2019 4:45:47 AM,Green spiral,kserikba,2.63,12,15,15,15,5,0,2019-10-13 04:45:47,11,10,13,4017,273,4303
12579,10/13/2019 1:52:17 AM,Thick Plus  II (Stack version),drmazhar,2.33,10,9,9,9,2,0,2019-10-13 01:52:17,11,10,13,4017,273,4303
12578,10/12/2019 12:12:43 PM,Thick Plus,jnpollack,2.33,10,9.6,10,9,3,0,2019-10-12 12:12:43,11,10,12,4017,273,4302
12577,10/11/2019 3:28:03 PM,Directions by Reds,drmazhar,3,6,7,7,7,2,0,2019-10-11 15:28:03,11,10,11,4017,273,4301
12576,10/10/2019 2:31:31 AM,Comman for Different,drmazhar,2.4,8,10,10,10,4,0,2019-10-10 02:31:31,11,10,10,4017,273,4300
12575,10/8/2019 8:57:57 PM,????? (Version 2),jnpollack,4,3,7,7,7,0,0,2019-10-08 20:57:57,11,10,8,4017,273,4298
12574,10/8/2019 2:48:03 PM,Odds and Evens (Lite edition),scorpio,3,16,11.125,11,11,11,0,2019-10-08 14:48:03,11,10,8,4017,273,4298
12573,10/8/2019 12:30:00 PM,cosmonavt,artemka1306,1.26,86,5,5,5,23,2,2019-10-08 12:30:00,11,10,8,4017,273,4298
12572,10/8/2019 12:11:45 PM,2+2=?,artemka1306,1.24,135,4,4,4,28,3,2019-10-08 12:11:45,11,10,8,4017,273,4298
12571,10/8/2019 11:43:23 AM,pro vs nub!!!,artemka1306,1.3,140,5.8857142857,4,4,22,5,2019-10-08 11:43:23,11,10,8,4017,273,4298
12570,10/8/2019 11:18:22 AM,?????,artemka1306,1.17,77,7.3896103896,6,4,17,4,2019-10-08 11:18:22,11,10,8,4017,273,4298
12569,10/6/2019 6:03:18 PM,"Store,Skip and Add",drmazhar,3,2,18,0,17,0,0,2019-10-06 18:03:18,11,10,6,4017,273,4296
12568,10/4/2019 9:05:32 AM,A trip to the top (Part 7),drmazhar,4,2,26.5,0,25,1,0,2019-10-04 09:05:32,11,10,4,4017,273,4294
12567,10/3/2019 11:42:52 AM,Unicolor,dstroy,1.31,38,4.2105263158,4,4,9,1,2019-10-03 11:42:52,11,10,3,4017,273,4293
12566,10/2/2019 3:51:21 PM,Lots of Knots,setnado,3.2,13,10,10,10,9,0,2019-10-02 15:51:21,11,10,2,4017,273,4292
12565,10/2/2019 12:26:22 PM,Green Wall,dstroy,2.22,19,8.6315789474,9,8,6,0,2019-10-02 12:26:22,11,10,2,4017,273,4292
12564,10/2/2019 12:22:01 PM,Come back,dstroy,1.5,29,8,8,8,5,1,2019-10-02 12:22:01,11,10,2,4017,273,4292
12563,10/2/2019 12:19:29 PM,You decide the way.,dstroy,1.78,24,8.625,0,6,3,1,2019-10-02 12:19:29,11,10,2,4017,273,4292
12562,10/2/2019 6:27:20 AM,Colorful path,dstroy,2.3,18,7.6111111111,7,7,8,0,2019-10-02 06:27:20,11,10,2,4017,273,4292
12561,10/2/2019 6:13:59 AM,Just an other easy puzzle.,dstroy,1.5,29,6,6,6,5,1,2019-10-02 06:13:59,11,10,2,4017,273,4292
12560,10/1/2019 11:04:41 AM,Paul.,dstroy,1.42,32,8.625,8,8,6,1,2019-10-01 11:04:41,11,10,1,4017,273,4291
12559,10/1/2019 8:35:49 AM,Crossing the cross,dstroy,1.31,38,7,7,7,10,2,2019-10-01 08:35:49,11,10,1,4017,273,4291
12558,10/1/2019 12:27:26 AM,Triangular Release,jnpollack,3.5,4,18,18,18,3,0,2019-10-01 00:27:26,11,10,1,4017,273,4291
12557,9/30/2019 3:22:45 PM,Still a simple cross III,drmazhar,2.25,8,6,6,6,3,0,2019-09-30 15:22:45,11,9,30,4017,243,4290
12556,9/30/2019 3:04:18 PM,Still a simple cross II,drmazhar,2,11,5.0909090909,5,5,4,1,2019-09-30 15:04:18,11,9,30,4017,243,4290
12555,9/29/2019 2:58:55 PM,Dropping the ball,drmazhar,2.5,3,12.6666666667,13,12,1,0,2019-09-29 14:58:55,11,9,29,4017,243,4289
12554,9/28/2019 4:56:12 PM,NeverSureWhatI'mDoing,jnpollack,3.5,6,15.1666666667,0,14,3,0,2019-09-28 16:56:12,11,9,28,4017,243,4288
12553,9/28/2019 12:41:17 PM,Exercise for myself,kserikba,3,7,20,20,20,3,0,2019-09-28 12:41:17,11,9,28,4017,243,4288
12552,9/28/2019 12:10:32 AM,lvl 14. II,drmazhar,2.5,3,14,14,14,2,0,2019-09-28 00:10:32,11,9,28,4017,243,4288
12551,9/27/2019 4:13:51 PM,lvl 14.,dstroy,1.58,27,10.5925925926,11,10,8,1,2019-09-27 16:13:51,11,9,27,4017,243,4287
12550,9/26/2019 6:43:34 PM,TIC/TOC,jnpollack,3,3,23,0,21,0,0,2019-09-26 18:43:34,11,9,26,4017,243,4286
12549,9/26/2019 3:18:46 PM,Stack Control (Version 2),drmazhar,2.25,7,9.8571428571,10,9,3,0,2019-09-26 15:18:46,11,9,26,4017,243,4286
12548,9/26/2019 2:53:25 PM,Stack Control,drmazhar,2.4,8,10.25,10,10,4,0,2019-09-26 14:53:25,11,9,26,4017,243,4286
12547,9/25/2019 3:11:58 PM,Cameron_ada...'s work tile 2,kserikba,2.33,8,7.375,8,6,2,2,2019-09-25 15:11:58,11,9,25,4017,243,4285
12546,9/25/2019 2:50:25 PM,Interesting Tile,kserikba,2,10,7.7,8,6,2,1,2019-09-25 14:50:25,11,9,25,4017,243,4285
12545,9/24/2019 11:07:26 PM,Septopus,jnpollack,3,2,18,0,17,0,0,2019-09-24 23:07:26,11,9,24,4017,243,4284
12544,9/24/2019 8:13:42 AM,OR with 2 bits,drmazhar,3,3,16.6666666667,0,15,1,0,2019-09-24 08:13:42,11,9,24,4017,243,4284
12543,9/24/2019 2:42:43 AM,Spring 11,drmazhar,4,2,21,0,20,1,0,2019-09-24 02:42:43,11,9,24,4017,243,4284
12542,9/22/2019 12:09:32 PM,Experiment,kserikba,2,19,7,7,7,5,1,2019-09-22 12:09:32,11,9,22,4017,243,4282
12541,9/21/2019 11:47:00 AM,5,kserikba,1.64,21,12.6666666667,12,12,5,1,2019-09-21 11:47:00,11,9,21,4017,243,4281
12540,9/21/2019 8:50:43 AM,To red and back,kserikba,2.17,9,18.5555555556,12,12,4,1,2019-09-21 08:50:43,11,9,21,4017,243,4281
12539,9/21/2019 5:55:15 AM,Green and red,kserikba,1.9,22,7.3636363636,7,7,7,0,2019-09-21 05:55:15,11,9,21,4017,243,4281
12538,9/20/2019 2:14:36 PM,"very beauty, such smart, much wow",dumbspark,2,4,12.25,10,10,1,1,2019-09-20 14:14:36,11,9,20,4017,243,4280
12537,9/20/2019 2:06:06 PM,INF2019_08,dumbspark,2,4,12.5,0,10,0,0,2019-09-20 14:06:06,11,9,20,4017,243,4280
12536,9/20/2019 2:04:18 AM,Postponed Pop (Version 2),drmazhar,3.25,7,8,8,8,4,0,2019-09-20 02:04:18,11,9,20,4017,243,4280
12535,9/17/2019 10:45:42 AM,Do you know da way?,setnado,3.43,9,19.5555555556,20,19,7,0,2019-09-17 10:45:42,11,9,17,4017,243,4277
12534,9/17/2019 4:20:10 AM,"JP ("" Jared Pollack "")",drmazhar,2.57,10,16.3,16,15,6,1,2019-09-17 04:20:10,11,9,17,4017,243,4277
12532,9/16/2019 2:58:26 AM,(1/2) OR (1/5),drmazhar,3,6,12.8333333333,13,12,4,0,2019-09-16 02:58:26,11,9,16,4017,243,4276
12531,9/15/2019 4:07:35 AM,Turn at the half,scorpio,5,2,13,13,13,1,0,2019-09-15 04:07:35,11,9,15,4017,243,4275
12530,9/12/2019 5:44:38 AM,Gate at the half,drmazhar,2.8,17,15.6470588235,16,15,12,0,2019-09-12 05:44:38,11,9,12,4017,243,4272
12529,9/9/2019 2:50:28 PM,Flying Fishy II - Respect & Humility  II,drmazhar,2.4,17,6,6,6,8,1,2019-09-09 14:50:28,11,9,9,4017,243,4269
12528,9/9/2019 11:55:41 AM,Flying Fishy II - Respect & Humility,jnpollack,1.7,25,4,4,4,7,2,2019-09-09 11:55:41,11,9,9,4017,243,4269
12527,9/8/2019 6:38:47 PM,My First,Hoppy_,2,18,8.1666666667,9,5,5,2,2019-09-08 18:38:47,11,9,8,4017,243,4268
12526,9/8/2019 8:57:15 AM,S or 5,kserikba,1.8,19,11.4736842105,9,9,7,1,2019-09-08 08:57:15,11,9,8,4017,243,4268
12525,9/7/2019 2:40:34 PM,Aggregations,drmazhar,3,8,25,24,23,3,0,2019-09-07 14:40:34,11,9,7,4017,243,4267
12524,9/5/2019 10:02:21 PM,F1 if Blue,jnpollack,4,5,8,8,8,2,0,2019-09-05 22:02:21,11,9,5,4017,243,4265
12523,9/4/2019 2:21:06 PM,Reflection (Version 8),drmazhar,3,5,23,24,21,3,0,2019-09-04 14:21:06,11,9,4,4017,243,4264
12522,9/2/2019 2:26:31 PM,Odds and Evens,scorpio,5,2,19.5,0,19,1,0,2019-09-02 14:26:31,11,9,2,4017,243,4262
12521,9/2/2019 1:44:14 PM,Multi Another speed control (Id:192),drmazhar,3,2,30,0,27,1,0,2019-09-02 13:44:14,11,9,2,4017,243,4262
12520,8/31/2019 12:38:58 PM,Delta,drmazhar,2.6,10,15,15,15,4,0,2019-08-31 12:38:58,11,8,31,4017,212,4260
12519,8/28/2019 11:24:56 AM,Glass House Troll,jnpollack,3,2,13,13,13,0,0,2019-08-28 11:24:56,11,8,28,4017,212,4257
12518,8/24/2019 6:34:25 AM,Instruction (Version 2),drmazhar,2.2,8,16,16,16,4,0,2019-08-24 06:34:25,11,8,24,4017,212,4253
12516,8/22/2019 12:20:35 AM,Playing With stacks  (Version 2),drmazhar,3,5,9,9,9,2,0,2019-08-22 00:20:35,11,8,22,4017,212,4251
12515,8/21/2019 5:16:56 PM,The Basics #5,nathan36098,1.42,41,5.6097560976,6,5,10,4,2019-08-21 17:16:56,11,8,21,4017,212,4250
12514,8/21/2019 5:12:44 PM,The Basics #4,nathan36098,1.31,50,7,7,7,12,2,2019-08-21 17:12:44,11,8,21,4017,212,4250
12513,8/21/2019 5:01:52 PM,The Basics #3,nathan36098,1.23,119,6,6,6,23,3,2019-08-21 17:01:52,11,8,21,4017,212,4250
12512,8/21/2019 4:57:39 PM,The Basics #2,nathan36098,1.27,45,5,5,5,9,1,2019-08-21 16:57:39,11,8,21,4017,212,4250
12511,8/21/2019 4:50:40 PM,The Basics #1,nathan36098,1.14,170,5,5,5,27,6,2019-08-21 16:50:40,11,8,21,4017,212,4250
12510,8/21/2019 1:46:34 AM,Aadaptation,drmazhar,3,7,21.2857142857,0,19,2,0,2019-08-21 01:46:34,11,8,21,4017,212,4250
12509,8/20/2019 1:08:12 AM,Red Signs,drmazhar,2.2,10,10.5,0,10,4,0,2019-08-20 01:08:12,11,8,20,4017,212,4249
12508,8/18/2019 9:15:45 PM,Discerete Patterns,drmazhar,2,8,10.125,10,10,3,0,2019-08-18 21:15:45,11,8,18,4017,212,4247
12507,8/17/2019 6:26:56 PM,Go & Back (Version 5),drmazhar,2.33,8,13.75,14,12,3,0,2019-08-17 18:26:56,11,8,17,4017,212,4246
12506,8/17/2019 10:59:37 AM,Other Side,drmazhar,2.5,11,15.5454545455,16,15,4,0,2019-08-17 10:59:37,11,8,17,4017,212,4246
12505,8/17/2019 10:21:11 AM,Ignore Reds,drmazhar,1.8,8,18,0,13,0,3,2019-08-17 10:21:11,11,8,17,4017,212,4246
12504,8/13/2019 5:23:11 PM,Crawl & Double Blue Tiles,scorpio,4,2,17,17,17,1,0,2019-08-13 17:23:11,11,8,13,4017,212,4242
12503,8/10/2019 9:57:32 PM,The Same with Odd & the Double with Even,drmazhar,2.33,6,22.6666666667,0,20,1,0,2019-08-10 21:57:32,11,8,10,4017,212,4239
12502,8/5/2019 7:20:54 AM,"Red,Green and Green with Red",drmazhar,2.57,9,8.5555555556,9,8,5,0,2019-08-05 07:20:54,11,8,5,4017,212,4234
12501,8/4/2019 2:58:52 AM,Radar (Version 3),drmazhar,3,3,29.3333333333,31,26,1,0,2019-08-04 02:58:52,11,8,4,4017,212,4233
12500,8/2/2019 8:38:53 PM,Maximum is  Three,drmazhar,3,4,20.5,22,18,2,0,2019-08-02 20:38:53,11,8,2,4017,212,4231
12499,8/1/2019 10:40:23 AM,RedFlag,barburator,2.29,15,5,5,5,4,1,2019-08-01 10:40:23,11,8,1,4017,212,4230
12498,7/30/2019 10:00:08 AM,first,barburator,1.45,35,5.4285714286,5,5,6,2,2019-07-30 10:00:08,11,7,30,4017,181,4228
12497,7/29/2019 2:45:28 PM,Mountain,drmazhar,3,3,23.6666666667,0,19,2,0,2019-07-29 14:45:28,11,7,29,4017,181,4227
12496,7/29/2019 2:09:31 PM,1>2>3>4>5>6>7>8,drmazhar,3,5,13,13,13,2,0,2019-07-29 14:09:31,11,7,29,4017,181,4227
12495,7/29/2019 8:42:42 AM,GreenWay,barburator,1.89,23,5.6956521739,5,5,5,1,2019-07-29 08:42:42,11,7,29,4017,181,4227
12494,7/29/2019 8:35:25 AM,S-BIG,barburator,2.75,8,8,8,8,5,0,2019-07-29 08:35:25,11,7,29,4017,181,4227
12493,7/29/2019 1:59:27 AM,two side,barburator,2.5,18,13.1111111111,13,13,7,0,2019-07-29 01:59:27,11,7,29,4017,181,4227
12491,7/28/2019 2:29:40 PM,AltTest,barburator,1.75,27,6,6,6,6,1,2019-07-28 14:29:40,11,7,28,4017,181,4226
12490,7/27/2019 3:12:35 AM,Dual purpose (Version 4),drmazhar,3,4,28.75,30,26,1,0,2019-07-27 03:12:35,11,7,27,4017,181,4225
12489,7/26/2019 2:53:29 AM,Parallelogram (Version 2),drmazhar,1.88,18,14,16,10,6,1,2019-07-26 02:53:29,11,7,26,4017,181,4224
12488,7/25/2019 7:53:08 AM,Interrupt (Version 4),drmazhar,2.5,6,8,8,8,3,0,2019-07-25 07:53:08,11,7,25,4017,181,4223
12487,7/25/2019 7:05:05 AM,Popping Control,drmazhar,4,2,22.5,0,22,1,0,2019-07-25 07:05:05,11,7,25,4017,181,4223
12486,7/24/2019 2:02:47 PM,Semi Diagonals,drmazhar,2,17,7,7,7,8,1,2019-07-24 14:02:47,11,7,24,4017,181,4222
12485,7/23/2019 2:31:06 PM,Increasing Squares III,drmazhar,3,4,15,15,15,2,1,2019-07-23 14:31:06,11,7,23,4017,181,4221
12484,7/23/2019 11:25:09 AM,Paint Power of 2 Generator,jnpollack,4,4,28,0,27,2,0,2019-07-23 11:25:09,11,7,23,4017,181,4221
12483,7/22/2019 8:16:47 PM,Increasing Crosses,jnpollack,3,7,13,13,13,3,0,2019-07-22 20:16:47,11,7,22,4017,181,4220
12482,7/21/2019 5:31:10 AM,Interrupt (Version 3),drmazhar,3,3,13,13,13,1,0,2019-07-21 05:31:10,11,7,21,4017,181,4219
12481,7/20/2019 9:53:19 PM,135531,jnpollack,3,2,14,0,13,0,0,2019-07-20 21:53:19,11,7,20,4017,181,4218
12480,7/20/2019 1:41:21 PM,snake star,Mare,1.8,22,7.6818181818,8,7,5,2,2019-07-20 13:41:21,11,7,20,4017,181,4218
12479,7/20/2019 1:20:21 PM,Go & Back (Version 4),drmazhar,2.67,6,13,13,13,1,0,2019-07-20 13:20:21,11,7,20,4017,181,4218
12477,7/19/2019 12:29:50 AM,Absolute difference,scorpio,3,4,13.5,13,13,3,0,2019-07-19 00:29:50,11,7,19,4017,181,4217
12476,7/18/2019 1:54:23 AM,Interrupt (Version 2),drmazhar,3,2,20,20,20,1,0,2019-07-18 01:54:23,11,7,18,4017,181,4216
12475,7/17/2019 8:47:41 PM,Breaking the System,setnado,3,7,14.5714285714,15,12,3,0,2019-07-17 20:47:41,11,7,17,4017,181,4215
12474,7/17/2019 8:14:52 AM,Interrupt,drmazhar,3,3,28.3333333333,0,23,1,0,2019-07-17 08:14:52,11,7,17,4017,181,4215
12473,7/17/2019 12:33:04 AM,Seismic Stack,jnpollack,3.5,5,19.6,20,19,3,0,2019-07-17 00:33:04,11,7,17,4017,181,4215
12472,7/15/2019 9:57:20 PM,Acid Rain,jnpollack,3.6,5,22.4,23,20,4,0,2019-07-15 21:57:20,11,7,15,4017,181,4213
12471,7/15/2019 3:29:09 PM,Mazharian Magic,jnpollack,3.75,5,22.2,0,19,3,0,2019-07-15 15:29:09,11,7,15,4017,181,4213
12470,7/15/2019 7:53:12 AM,Information Gathering 6,drmazhar,3,3,13.3333333333,13,13,1,0,2019-07-15 07:53:12,11,7,15,4017,181,4213
12469,7/15/2019 12:16:23 AM,Systematic,drmazhar,1.88,20,14.85,15,13,6,0,2019-07-15 00:16:23,11,7,15,4017,181,4213
12467,7/13/2019 11:45:23 AM,Zero Stack (Version 2),drmazhar,3,5,33.8,36,27,2,0,2019-07-13 11:45:23,11,7,13,4017,181,4211
12466,7/12/2019 10:03:16 AM,Easy Squares,drmazhar,2.4,8,10,10,10,3,0,2019-07-12 10:03:16,11,7,12,4017,181,4210
12465,7/11/2019 1:54:08 PM,Two changing,drmazhar,2.33,5,19,17,17,1,0,2019-07-11 13:54:08,11,7,11,4017,181,4209
12464,7/11/2019 8:52:54 AM,CHESS,rockman,1.69,23,16.5652173913,14,14,6,3,2019-07-11 08:52:54,11,7,11,4017,181,4209
12463,7/11/2019 8:16:23 AM,NANNY MC PHEE,rockman,1.17,80,6.025,6,6,18,7,2019-07-11 08:16:23,11,7,11,4017,181,4209
12462,7/11/2019 8:07:45 AM,2+2,rockman,1.31,57,6.0526315789,6,6,8,8,2019-07-11 08:07:45,11,7,11,4017,181,4209
12461,7/11/2019 7:21:42 AM,1+1,rockman,1.58,29,6.4137931034,6,6,5,2,2019-07-11 07:21:42,11,7,11,4017,181,4209
12460,7/11/2019 12:54:40 AM,Special Case of Reflection (Version 6),drmazhar,3,2,19.5,0,18,1,0,2019-07-11 00:54:40,11,7,11,4017,181,4209
12459,7/10/2019 11:18:14 PM,Star Cleanser,jnpollack,3.5,2,22,22,22,1,0,2019-07-10 23:18:14,11,7,10,4017,181,4208
12457,7/10/2019 1:01:48 AM,Pushing up the base.,drmazhar,2.33,11,18.4545454545,19,14,3,0,2019-07-10 01:01:48,11,7,10,4017,181,4208
12455,7/8/2019 5:37:44 PM,Pitchfork Spiral,jnpollack,3.5,2,13,13,13,1,0,2019-07-08 17:37:44,11,7,8,4017,181,4206
12454,7/5/2019 7:41:33 PM,"Beyond Vulgar, Offensive, & Obnoxious",jnpollack,3.5,2,9,9,9,0,1,2019-07-05 19:41:33,11,7,5,4017,181,4203
12453,7/5/2019 2:48:15 PM,Special Spiral (Version 4),drmazhar,2,6,11,11,11,2,0,2019-07-05 14:48:15,11,7,5,4017,181,4203
12452,7/4/2019 3:30:04 PM,"Vulgar, Offensive, and Obnoxious",jnpollack,3,2,25,0,24,0,0,2019-07-04 15:30:04,11,7,4,4017,181,4202
12451,7/4/2019 1:49:09 PM,Assembling,drmazhar,4,2,19,0,18,1,0,2019-07-04 13:49:09,11,7,4,4017,181,4202
12450,7/3/2019 5:57:59 AM,End at Begining,drmazhar,3.5,3,15,0,14,1,0,2019-07-03 05:57:59,11,7,3,4017,181,4201
12449,7/1/2019 2:48:55 PM,Magnificent 7,jnpollack,3.5,3,7,7,7,1,0,2019-07-01 14:48:55,11,7,1,4017,181,4199
12448,7/1/2019 8:35:52 AM,big red X 2 III,drmazhar,3,3,11.6666666667,11,11,2,0,2019-07-01 08:35:52,11,7,1,4017,181,4199
12447,7/1/2019 8:05:49 AM,big red X 2 II,drmazhar,3.67,4,7,7,7,2,0,2019-07-01 08:05:49,11,7,1,4017,181,4199
12446,7/1/2019 6:41:39 AM,Disarticulated,axorion,3,2,18.5,0,18,0,0,2019-07-01 06:41:39,11,7,1,4017,181,4199
12445,6/30/2019 10:49:19 PM,Behind Bars,jnpollack,3,3,9,9,9,0,0,2019-06-30 22:49:19,11,6,30,4017,151,4198
12444,6/30/2019 5:41:04 PM,RightUpPaint,jnpollack,3.25,7,19,19,19,2,0,2019-06-30 17:41:04,11,6,30,4017,151,4198
12443,6/29/2019 8:07:03 PM,C-Clamps,jnpollack,3,3,28.3333333333,0,27,1,0,2019-06-29 20:07:03,11,6,29,4017,151,4197
12442,6/28/2019 8:01:23 AM,Optimum Iteration,axorion,3,2,15,15,15,1,0,2019-06-28 08:01:23,11,6,28,4017,151,4196
12441,6/28/2019 4:56:49 AM,Pyramid's property,drmazhar,3.33,3,16.3333333333,0,15,1,0,2019-06-28 04:56:49,11,6,28,4017,151,4196
12440,6/28/2019 1:40:55 AM,Go & Back (Version 3),drmazhar,3,6,21.1666666667,21,20,2,0,2019-06-28 01:40:55,11,6,28,4017,151,4196
12439,6/27/2019 8:31:00 PM,BOTSPORT,jnpollack,3,3,24,22,22,2,0,2019-06-27 20:31:00,11,6,27,4017,151,4195
12438,6/27/2019 8:53:42 AM,BOGO,axorion,3,2,18.5,0,18,1,0,2019-06-27 08:53:42,11,6,27,4017,151,4195
12437,6/26/2019 7:40:49 PM,Discrete Spiral,drmazhar,2.33,5,13,13,13,2,0,2019-06-26 19:40:49,11,6,26,4017,151,4194
12436,6/26/2019 12:22:31 PM,Stacking for Simpletons...,jnpollack,2.71,12,7,7,7,3,1,2019-06-26 12:22:31,11,6,26,4017,151,4194
12435,6/25/2019 11:18:40 PM,Candlestick,drmazhar,3,5,26,0,25,3,0,2019-06-25 23:18:40,11,6,25,4017,151,4193
12434,6/25/2019 1:36:12 AM,Outside In,jnpollack,2.5,7,5,5,5,3,0,2019-06-25 01:36:12,11,6,25,4017,151,4193
12433,6/24/2019 10:48:13 PM,Atomic Orbital II,jnpollack,4,2,9,9,9,0,0,2019-06-24 22:48:13,11,6,24,4017,151,4192
12432,6/24/2019 7:42:00 AM,Constant Height,drmazhar,3,5,22.6,22,21,4,0,2019-06-24 07:42:00,11,6,24,4017,151,4192
12431,6/24/2019 12:09:54 AM,Atomic Orbital,jnpollack,3,3,8,8,8,1,0,2019-06-24 00:09:54,11,6,24,4017,151,4192
12430,6/23/2019 11:19:20 PM,People Will See,jnpollack,3,2,9,9,9,0,0,2019-06-23 23:19:20,11,6,23,4017,151,4191
12429,6/23/2019 2:01:10 AM,Matching Right Hand,drmazhar,4,2,29,0,26,1,0,2019-06-23 02:01:10,11,6,23,4017,151,4191
12428,6/23/2019 12:58:47 AM,Interference,scorpio,4,2,19,19,19,1,0,2019-06-23 00:58:47,11,6,23,4017,151,4191
12427,6/22/2019 11:45:19 AM,WARNING: Ambiguous Path | Extra Slots,jnpollack,2.5,4,9.25,9,9,0,0,2019-06-22 11:45:19,11,6,22,4017,151,4190
12425,6/21/2019 1:32:10 PM,Just a Drop,jnpollack,3,2,9,0,8,0,0,2019-06-21 13:32:10,11,6,21,4017,151,4189
12424,6/20/2019 11:27:53 PM,Space Invader II,jnpollack,4,2,13,13,13,0,0,2019-06-20 23:27:53,11,6,20,4017,151,4188
12423,6/20/2019 1:34:24 PM,very easy,jjjddd,1.44,55,4.6,4,4,12,7,2019-06-20 13:34:24,11,6,20,4017,151,4188
12422,6/20/2019 9:02:05 AM,Preparations 5,drmazhar,3,3,23.6666666667,22,22,2,0,2019-06-20 09:02:05,11,6,20,4017,151,4188
12421,6/19/2019 6:04:33 PM,Derpy 2.0,setnado,3,6,19.8333333333,20,17,3,0,2019-06-19 18:04:33,11,6,19,4017,151,4187
12420,6/19/2019 1:28:36 AM,Tangled Spiral,jnpollack,3,6,12.6666666667,0,11,3,0,2019-06-19 01:28:36,11,6,19,4017,151,4187
12419,6/18/2019 10:16:56 PM,Level 1,Charlie4285,1.12,331,4,4,4,54,12,2019-06-18 22:16:56,11,6,18,4017,151,4186
12418,6/15/2019 9:53:35 PM,Dual purpose (Version 3),drmazhar,3.33,4,18.5,0,17,2,0,2019-06-15 21:53:35,11,6,15,4017,151,4183
12417,6/15/2019 7:42:15 AM,Zero Stack,drmazhar,2.2,9,24.1111111111,25,23,2,0,2019-06-15 07:42:15,11,6,15,4017,151,4183
12416,6/14/2019 8:52:02 PM,Re-arrangement,drmazhar,4.5,2,26.5,0,26,1,0,2019-06-14 20:52:02,11,6,14,4017,151,4182
12414,6/14/2019 9:50:24 AM,P,lordofdead38,1.44,52,7,7,7,9,2,2019-06-14 09:50:24,11,6,14,4017,151,4182
12413,6/12/2019 11:43:16 PM,The ADHD Bot,jnpollack,4,3,8,8,8,0,0,2019-06-12 23:43:16,11,6,12,4017,151,4180
12412,6/12/2019 2:52:22 AM,Playing With Stacks,drmazhar,4,2,13,13,13,1,0,2019-06-12 02:52:22,11,6,12,4017,151,4180
12411,6/11/2019 7:41:10 AM,Simply Simple,axorion,3,3,8,8,8,0,1,2019-06-11 07:41:10,11,6,11,4017,151,4179
12410,6/11/2019 7:17:55 AM,Special Spiral (Version 3),drmazhar,2.75,6,13,13,13,2,0,2019-06-11 07:17:55,11,6,11,4017,151,4179
12409,6/11/2019 1:33:23 AM,5>4>3>2>1,drmazhar,2.29,13,15,15,15,5,0,2019-06-11 01:33:23,11,6,11,4017,151,4179
12408,6/10/2019 2:23:36 AM,Discrete Distances.,drmazhar,2.5,6,10,10,10,2,0,2019-06-10 02:23:36,11,6,10,4017,151,4178
12406,6/8/2019 9:31:21 PM,Discrete Increasing,drmazhar,2.67,6,13.6666666667,14,13,2,0,2019-06-08 21:31:21,11,6,8,4017,151,4176
12405,6/8/2019 12:52:36 PM,Discrete Reflection,drmazhar,3.75,5,23.6,25,21,2,0,2019-06-08 12:52:36,11,6,8,4017,151,4176
12404,6/7/2019 3:15:01 PM,One quarter of the information (Lite edition),scorpio,3.5,4,13.25,13,13,2,0,2019-06-07 15:15:01,11,6,7,4017,151,4175
12403,6/7/2019 3:06:09 PM,One quarter of the information,scorpio,5,3,14.3333333333,14,14,2,0,2019-06-07 15:06:09,11,6,7,4017,151,4175
12402,6/7/2019 9:21:13 AM,Human  Body,drmazhar,3,3,21.6666666667,22,21,2,0,2019-06-07 09:21:13,11,6,7,4017,151,4175
12401,6/6/2019 1:48:11 PM,One way ticket (Lite edition),scorpio,2.8,7,14.4285714286,14,14,4,0,2019-06-06 13:48:11,11,6,6,4017,151,4174
12400,6/4/2019 3:00:22 AM,Stampy's face !,Cico,1.46,31,6.5806451613,6,5,3,4,2019-06-04 03:00:22,11,6,4,4017,151,4172
12399,6/3/2019 12:15:14 AM,Exponential Growth II,jnpollack,3.5,3,16,16,16,1,0,2019-06-03 00:15:14,11,6,3,4017,151,4171
12398,6/1/2019 1:09:48 AM,One way ticket,scorpio,4,3,20.3333333333,19,19,2,0,2019-06-01 01:09:48,11,6,1,4017,151,4169
12397,5/31/2019 2:53:52 AM,Ducky !!!!!!!!!!!!!!!!!!,Cico,1.18,266,4.2218045113,4,4,42,21,2019-05-31 02:53:52,11,5,31,4017,120,4168
12396,5/31/2019 2:26:24 AM,Dimand Minecraft wand,Cico,1.29,44,5.0227272727,5,5,8,5,2019-05-31 02:26:24,11,5,31,4017,120,4168
12395,5/31/2019 2:17:38 AM,lava!,Cico,1.17,96,12.4270833333,15,6,16,8,2019-05-31 02:17:38,11,5,31,4017,120,4168
12394,5/31/2019 2:07:28 AM,Rain!,Cico,2,20,6.2,4,4,4,2,2019-05-31 02:07:28,11,5,31,4017,120,4168
12393,5/31/2019 2:05:57 AM,Rain,Cico,1.19,91,8.1978021978,9,4,19,4,2019-05-31 02:05:57,11,5,31,4017,120,4168
12392,5/29/2019 8:01:31 PM,Josephus problem 4,drmazhar,3,2,19,0,17,1,0,2019-05-29 20:01:31,11,5,29,4017,120,4166
12391,5/29/2019 7:37:16 PM,Josephus problem 3,drmazhar,3,2,19.5,0,16,0,0,2019-05-29 19:37:16,11,5,29,4017,120,4166
12390,5/29/2019 3:36:41 AM,Flying Fishy,Cico,1.47,40,4.8,5,4,8,3,2019-05-29 03:36:41,11,5,29,4017,120,4166
12389,5/29/2019 2:40:03 AM,Bus,Cico,1.33,76,6.75,4,4,19,7,2019-05-29 02:40:03,11,5,29,4017,120,4166
12388,5/29/2019 2:29:16 AM,c0nfus10N,Cico,1.44,34,4.1470588235,4,4,6,5,2019-05-29 02:29:16,11,5,29,4017,120,4166
12387,5/28/2019 11:14:19 AM,Redshift II,scorpio,3,4,18.5,0,18,2,0,2019-05-28 11:14:19,11,5,28,4017,120,4165
12386,5/27/2019 12:46:31 PM,Blue-Green Inversion,scorpio,3,4,23,0,21,2,0,2019-05-27 12:46:31,11,5,27,4017,120,4164
12385,5/24/2019 9:24:06 PM,Nossa foi dificil fazer este,12345joao,1.64,24,16.75,14,6,3,3,2019-05-24 21:24:06,11,5,24,4017,120,4161
12384,5/24/2019 5:26:41 PM,"""2X"" Or ""X+1""",drmazhar,2.63,13,11,11,11,9,0,2019-05-24 17:26:41,11,5,24,4017,120,4161
12383,5/24/2019 4:21:02 PM,Redshift,scorpio,3,2,18.5,0,17,1,0,2019-05-24 16:21:02,11,5,24,4017,120,4161
12382,5/23/2019 4:53:02 PM,Clean your ways ( Version 2),drmazhar,3,3,18.6666666667,19,18,1,0,2019-05-23 16:53:02,11,5,23,4017,120,4160
12381,5/20/2019 7:49:03 PM,Starch,jnpollack,2,3,11,11,11,0,0,2019-05-20 19:49:03,11,5,20,4017,120,4157
12380,5/20/2019 1:23:47 PM,Fountain,scorpio,2,2,21,21,21,1,0,2019-05-20 13:23:47,11,5,20,4017,120,4157
12379,5/18/2019 9:13:53 PM,Access Point III,scorpio,2.6,8,11,11,11,5,0,2019-05-18 21:13:53,11,5,18,4017,120,4155
12378,5/18/2019 5:06:56 PM,Clean your ways,drmazhar,2.5,8,11,11,11,3,0,2019-05-18 17:06:56,11,5,18,4017,120,4155
12377,5/18/2019 4:30:43 PM,Road  Map (Version 3),drmazhar,2.75,7,12,12,12,4,0,2019-05-18 16:30:43,11,5,18,4017,120,4155
12376,5/17/2019 5:00:48 PM,Access Point II,scorpio,3,3,13.6666666667,14,13,1,0,2019-05-17 17:00:48,11,5,17,4017,120,4154
12375,5/17/2019 8:07:56 AM,Access Point,axorion,3.33,5,13,13,13,3,0,2019-05-17 08:07:56,11,5,17,4017,120,4154
12374,5/16/2019 3:45:15 PM,Three Stages,drmazhar,2.4,7,22.8571428571,23,22,3,0,2019-05-16 15:45:15,11,5,16,4017,120,4153
12373,5/14/2019 4:44:19 PM,Replication Engine 15,drmazhar,2.2,8,12,12,12,3,0,2019-05-14 16:44:19,11,5,14,4017,120,4151
12372,5/14/2019 7:50:54 AM,Decision by Comparision,drmazhar,2,4,15.5,16,14,1,0,2019-05-14 07:50:54,11,5,14,4017,120,4151
12371,5/12/2019 12:22:50 PM,Boomerang,axorion,3,2,18,18,18,1,0,2019-05-12 12:22:50,11,5,12,4017,120,4149
12370,5/11/2019 8:06:56 AM,Ratchet,axorion,3,2,17,17,17,1,0,2019-05-11 08:06:56,11,5,11,4017,120,4148
12369,5/9/2019 7:43:04 PM,Preparations XXS,scorpio,4,2,9,9,9,1,0,2019-05-09 19:43:04,11,5,9,4017,120,4146
12368,5/9/2019 6:19:08 AM,Preparations III,drmazhar,2.36,17,12,12,12,10,0,2019-05-09 06:19:08,11,5,9,4017,120,4146
12367,5/8/2019 4:50:34 AM,As Expected,drmazhar,2,7,12,12,12,2,0,2019-05-08 04:50:34,11,5,8,4017,120,4145
12366,5/3/2019 5:02:27 PM,Blow a spiral,scorpio,3,2,15,15,15,1,0,2019-05-03 17:02:27,11,5,3,4017,120,4140
12365,5/3/2019 3:47:35 AM,From Spiral to Rectangle,drmazhar,4,2,26.5,0,25,1,0,2019-05-03 03:47:35,11,5,3,4017,120,4140
12364,5/3/2019 3:33:40 AM,From Spiral to Solid Rectangle,drmazhar,2,16,18.3125,0,14,3,2,2019-05-03 03:33:40,11,5,3,4017,120,4140
12363,5/2/2019 4:53:59 PM,Early dead end alerts,scorpio,3,3,13,13,13,2,0,2019-05-02 16:53:59,11,5,2,4017,120,4139
12362,5/2/2019 3:18:42 AM,Accumulation,drmazhar,4,4,17,17,17,2,0,2019-05-02 03:18:42,11,5,2,4017,120,4139
12361,5/1/2019 10:59:49 PM,The Change,drmazhar,4,2,29.5,0,27,1,0,2019-05-01 22:59:49,11,5,1,4017,120,4138
12360,5/1/2019 1:42:18 PM,Memorizing the next turn,scorpio,3,2,9.5,0,9,1,0,2019-05-01 13:42:18,11,5,1,4017,120,4138
12359,5/1/2019 8:44:13 AM,Put Signs For Your Ways (Version 19),drmazhar,4,4,30.5,30,30,2,0,2019-05-01 08:44:13,11,5,1,4017,120,4138
12358,4/28/2019 1:23:48 AM,Three spirals,scorpio,4,3,14,14,14,2,0,2019-04-28 01:23:48,11,4,28,4017,90,4135
12357,4/27/2019 7:57:57 AM,Feast or Famine,axorion,3.25,5,14.2,14,14,3,0,2019-04-27 07:57:57,11,4,27,4017,90,4134
12356,4/26/2019 8:14:23 AM,Regular Quadrilaterals 2,axorion,3.5,5,25,28,20,4,0,2019-04-26 08:14:23,11,4,26,4017,90,4133
12355,4/25/2019 6:11:17 PM,Preparations  II,drmazhar,3,5,13,13,13,3,0,2019-04-25 18:11:17,11,4,25,4017,90,4132
12354,4/25/2019 7:31:24 AM,Regular Quadrilaterals,axorion,4,3,14,14,14,2,0,2019-04-25 07:31:24,11,4,25,4017,90,4132
12353,4/23/2019 9:17:49 PM,Squares,drmazhar,2.33,7,18.5714285714,19,17,5,0,2019-04-23 21:17:49,11,4,23,4017,90,4130
12352,4/20/2019 7:03:59 AM,Put signs for your Ways  (Version 18),drmazhar,2.25,10,10,10,10,4,0,2019-04-20 07:03:59,11,4,20,4017,90,4127
12351,4/19/2019 3:27:42 AM,Put Signs for you Ways (Version 17),drmazhar,2.5,6,15.1666666667,15,15,3,0,2019-04-19 03:27:42,11,4,19,4017,90,4126
12350,4/18/2019 9:56:00 AM,Put Signs For Your Ways (Version 16),drmazhar,3,2,21,0,18,1,0,2019-04-18 09:56:00,11,4,18,4017,90,4125
12349,4/17/2019 5:23:40 PM,Delayed Reflection,jnpollack,3.75,5,19.4,0,17,3,0,2019-04-17 17:23:40,11,4,17,4017,90,4124
12348,4/17/2019 12:59:49 AM,Red lines 2,jnpollack,2.11,13,11,11,11,5,1,2019-04-17 00:59:49,11,4,17,4017,90,4124
12347,4/15/2019 8:08:59 AM,Radar ( Version 1),drmazhar,3.25,5,22.8,21,20,4,0,2019-04-15 08:08:59,11,4,15,4017,90,4122
12346,4/15/2019 6:31:52 AM,Radar,drmazhar,2.8,8,11,11,11,3,0,2019-04-15 06:31:52,11,4,15,4017,90,4122
12345,4/13/2019 3:05:12 PM,The Black Hole,drmazhar,2,8,6.75,6,6,2,0,2019-04-13 15:05:12,11,4,13,4017,90,4120
12344,4/11/2019 3:20:17 PM,The Runaround,axorion,3,5,13,13,13,3,0,2019-04-11 15:20:17,11,4,11,4017,90,4118
12343,4/10/2019 10:02:35 AM,Boxed Lunch,jnpollack,4,2,19,19,19,0,0,2019-04-10 10:02:35,11,4,10,4017,90,4117
12342,4/9/2019 10:36:20 AM,Ivy,axorion,3,6,21.6666666667,22,21,3,0,2019-04-09 10:36:20,11,4,9,4017,90,4116
12341,4/9/2019 7:06:52 AM,Stage Board,drmazhar,2.8,7,9.2857142857,9,9,4,0,2019-04-09 07:06:52,11,4,9,4017,90,4116
12340,4/8/2019 8:34:52 PM,A Light Snack,jnpollack,3,6,12,12,12,3,0,2019-04-08 20:34:52,11,4,8,4017,90,4115
12339,4/8/2019 9:20:58 AM,YYY,drmazhar,3,4,24.5,25,23,2,0,2019-04-08 09:20:58,11,4,8,4017,90,4115
12338,4/7/2019 1:44:31 AM,Some thing from Spring,drmazhar,3,2,21.5,0,21,1,0,2019-04-07 01:44:31,11,4,7,4017,90,4114
12337,4/4/2019 9:39:57 PM,Half blind spiral,scorpio,3,2,12,12,12,1,0,2019-04-04 21:39:57,11,4,4,4017,90,4111
11335,4/2/2019 3:10:58 PM,Copy of a blue way,scorpio,3.5,4,9.25,9,9,3,0,2019-04-02 15:10:58,11,4,2,4017,90,4109
11334,4/2/2019 1:34:54 PM,Flip Flop Drip Drop (DC1),jnpollack,3,2,11,11,11,0,0,2019-04-02 13:34:54,11,4,2,4017,90,4109
11333,4/1/2019 9:05:28 AM,Only Even Reds,drmazhar,3,2,24.5,0,22,1,0,2019-04-01 09:05:28,11,4,1,4017,90,4108
11332,3/31/2019 8:52:55 AM,Go & Back (Version 2),drmazhar,4,2,29,29,29,1,0,2019-03-31 08:52:55,11,3,31,4017,59,4107
11331,3/31/2019 8:31:51 AM,Go & Back,drmazhar,2.25,6,12,12,12,3,0,2019-03-31 08:31:51,11,3,31,4017,59,4107
11330,3/30/2019 5:20:00 AM,Hard Condition,drmazhar,2,5,11.2,10,10,1,0,2019-03-30 05:20:00,11,3,30,4017,59,4106
11329,3/29/2019 12:26:56 PM,The Difference,drmazhar,4,2,26,0,24,0,0,2019-03-29 12:26:56,11,3,29,4017,59,4105
11328,3/29/2019 1:51:01 AM,Copy of the blue mask,scorpio,4,2,10.5,0,10,1,0,2019-03-29 01:51:01,11,3,29,4017,59,4105
11327,3/29/2019 12:22:34 AM,Circuit construction,scorpio,4,2,13.5,0,13,1,0,2019-03-29 00:22:34,11,3,29,4017,59,4105
11326,3/28/2019 11:13:23 AM,Free Pancakes,jnpollack,3,2,20,0,18,1,0,2019-03-28 11:13:23,11,3,28,4017,59,4104
11325,3/28/2019 7:00:21 AM,Cutting Corners,axorion,3,3,17,17,17,1,0,2019-03-28 07:00:21,11,3,28,4017,59,4104
11323,3/28/2019 2:45:51 AM,puzzle impossible,ajayjha25,1.29,56,5,5,5,11,4,2019-03-28 02:45:51,11,3,28,4017,59,4104
11322,3/27/2019 12:44:41 PM,Disintegration,jnpollack,4,2,25,25,25,0,0,2019-03-27 12:44:41,11,3,27,4017,59,4103
11320,3/26/2019 11:03:10 PM,STARS!!!!!!!!!!!!!!!,imjha,1.29,57,4,4,4,8,5,2019-03-26 23:03:10,11,3,26,4017,59,4102
11319,3/25/2019 2:41:34 PM,Hierarchy II,jnpollack,3.6,5,15.8,14,14,4,0,2019-03-25 14:41:34,11,3,25,4017,59,4101
11318,3/25/2019 4:40:01 AM,Increasing,drmazhar,3,5,15,15,15,1,0,2019-03-25 04:40:01,11,3,25,4017,59,4101
11317,3/25/2019 4:30:13 AM,Decreasing,drmazhar,3,7,14,14,14,2,0,2019-03-25 04:30:13,11,3,25,4017,59,4101
11316,3/23/2019 7:25:05 PM,Stars are on the left.,jnpollack,2.75,7,6,6,6,3,0,2019-03-23 19:25:05,11,3,23,4017,59,4099
11315,3/23/2019 10:03:47 AM,Cutting Corners,jnpollack,4,5,8,8,8,1,0,2019-03-23 10:03:47,11,3,23,4017,59,4099
11314,3/21/2019 9:41:59 PM,Spaghetti Legs,jnpollack,3.5,2,25,25,25,2,0,2019-03-21 21:41:59,11,3,21,4017,59,4097
11313,3/21/2019 6:49:15 PM,Length comparison,scorpio,4.33,5,9.6,10,9,3,0,2019-03-21 18:49:15,11,3,21,4017,59,4097
11312,3/21/2019 5:54:18 PM,Comparision,drmazhar,3,9,10.6666666667,11,10,5,0,2019-03-21 17:54:18,11,3,21,4017,59,4097
11311,3/19/2019 1:24:14 PM,gun,badurls,1.53,46,6.0217391304,5,5,8,3,2019-03-19 13:24:14,11,3,19,4017,59,4095
11310,3/19/2019 1:05:20 PM,dinosaur,badurls,1.35,53,10,10,10,7,4,2019-03-19 13:05:20,11,3,19,4017,59,4095
11309,3/19/2019 8:37:14 AM,Green Forward Green (Version 3),drmazhar,2.67,5,21.2,21,19,1,0,2019-03-19 08:37:14,11,3,19,4017,59,4095
11308,3/18/2019 10:53:26 AM,Holy Apple,jnpollack,2,3,7,7,7,0,0,2019-03-18 10:53:26,11,3,18,4017,59,4094
11307,3/15/2019 10:01:27 AM,Green Forward Green (Version 2),drmazhar,2.4,7,17.7142857143,17,15,4,0,2019-03-15 10:01:27,11,3,15,4017,59,4091
11306,3/13/2019 7:41:55 AM,Green forward Green,drmazhar,2.8,8,19,19,17,4,0,2019-03-13 07:41:55,11,3,13,4017,59,4089
11305,3/13/2019 12:17:21 AM,Second green,scorpio,3.75,5,16.2,17,15,4,0,2019-03-13 00:17:21,11,3,13,4017,59,4089
11304,3/12/2019 3:42:09 AM,Simpler Patterns,jnpollack,2.57,11,17,17,17,4,0,2019-03-12 03:42:09,11,3,12,4017,59,4088
11303,3/12/2019 1:12:09 AM,7 steps,scorpio,4,5,17.4,17,16,4,0,2019-03-12 01:12:09,11,3,12,4017,59,4088
11302,3/11/2019 9:47:06 AM,Three Instructions,drmazhar,2.5,3,28.6666666667,28,28,1,0,2019-03-11 09:47:06,11,3,11,4017,59,4087
11301,3/6/2019 9:12:24 PM,Copy then paste (Version 5),drmazhar,3,6,24.6666666667,25,23,2,0,2019-03-06 21:12:24,11,3,6,4017,59,4082
11300,3/6/2019 2:08:53 PM,Drunken stack 4,qinn,3.5,3,21.6666666667,21,21,2,0,2019-03-06 14:08:53,11,3,6,4017,59,4082
11299,3/4/2019 12:48:51 PM,Shortened spiral,scorpio,4,9,7,7,7,4,0,2019-03-04 12:48:51,11,3,4,4017,59,4080
11298,3/4/2019 6:11:17 AM,Double Counting (Version 3),drmazhar,3,8,21.25,21,16,3,0,2019-03-04 06:11:17,11,3,4,4017,59,4080
11297,3/3/2019 8:49:08 PM,Copy then Paste (Version 4),drmazhar,3.25,7,20.1428571429,21,19,4,0,2019-03-03 20:49:08,11,3,3,4017,59,4079
11296,3/2/2019 11:35:23 PM,Blue figure copy,scorpio,4,3,21.3333333333,21,21,2,0,2019-03-02 23:35:23,11,3,2,4017,59,4078
11295,3/2/2019 11:13:06 PM,Training Day Extract,jnpollack,3.38,13,7,7,7,8,0,2019-03-02 23:13:06,11,3,2,4017,59,4078
11294,3/1/2019 2:47:27 AM,Black cat copy,scorpio,3,3,22,0,21,2,0,2019-03-01 02:47:27,11,3,1,4017,59,4077
11293,2/28/2019 10:48:59 PM,Stars splitting,scorpio,4,2,27,27,27,1,0,2019-02-28 22:48:59,11,2,28,4017,31,4076
11292,2/28/2019 8:53:06 AM,Something Common,drmazhar,3.6,8,15.375,15,14,3,0,2019-02-28 08:53:06,11,2,28,4017,31,4076
11291,2/27/2019 2:58:34 PM,Broken square II,scorpio,3.5,3,19.6666666667,20,19,2,0,2019-02-27 14:58:34,11,2,27,4017,31,4075
11290,2/27/2019 12:48:14 AM,Sampler Platter,jnpollack,4,2,25,25,25,0,0,2019-02-27 00:48:14,11,2,27,4017,31,4075
11289,2/26/2019 12:59:24 PM,fase,badurls,1.38,53,6.2641509434,6,6,6,3,2019-02-26 12:59:24,11,2,26,4017,31,4074
11288,2/26/2019 12:56:01 PM,???????,badurls,1.92,25,9.72,9,9,7,1,2019-02-26 12:56:01,11,2,26,4017,31,4074
11287,2/24/2019 2:58:57 PM,?? ????,StepovoyVlad,1.29,48,13.3125,9,7,5,3,2019-02-24 14:58:57,11,2,24,4017,31,4072
11286,2/24/2019 7:59:13 AM,Tracks,drmazhar,3,11,10,10,10,5,0,2019-02-24 07:59:13,11,2,24,4017,31,4072
11285,2/24/2019 12:19:01 AM,Chalk,jnpollack,3,9,16,0,15,3,0,2019-02-24 00:19:01,11,2,24,4017,31,4072
11284,2/21/2019 4:14:09 PM,Some Correction,drmazhar,2.13,13,10,10,10,5,0,2019-02-21 16:14:09,11,2,21,4017,31,4069
11283,2/21/2019 3:50:04 PM,Some Changing,drmazhar,2.46,22,10,10,10,11,0,2019-02-21 15:50:04,11,2,21,4017,31,4069
11282,2/20/2019 3:19:24 PM,Growing tree,scorpio,4,4,12,12,12,3,0,2019-02-20 15:19:24,11,2,20,4017,31,4068
11281,2/19/2019 8:33:02 AM,Special Case of Reflection (Version 5),drmazhar,3,7,17.8571428571,18,17,3,0,2019-02-19 08:33:02,11,2,19,4017,31,4067
11280,2/16/2019 10:31:18 AM,Dispersion (Version 7),drmazhar,2.33,10,14.7,15,13,4,0,2019-02-16 10:31:18,11,2,16,4017,31,4064
11279,2/15/2019 8:13:29 AM,Square Growth II,jnpollack,4,2,8,8,8,0,0,2019-02-15 08:13:29,11,2,15,4017,31,4063
11278,2/14/2019 2:12:18 AM,Complete,drmazhar,3,8,19.25,19,17,5,0,2019-02-14 02:12:18,11,2,14,4017,31,4062
11277,2/12/2019 9:15:38 PM,Complete Coverage,jnpollack,3,5,9,9,9,3,0,2019-02-12 21:15:38,11,2,12,4017,31,4060
11276,2/12/2019 6:30:30 PM,Warm-up X,jnpollack,3,9,12,12,12,4,0,2019-02-12 18:30:30,11,2,12,4017,31,4060
11275,2/11/2019 9:16:04 PM,Selection,drmazhar,2.8,9,16.1111111111,17,15,3,0,2019-02-11 21:16:04,11,2,11,4017,31,4059
11274,2/11/2019 7:46:43 PM,Matching The Triangles,drmazhar,2.2,10,21,26,14,1,0,2019-02-11 19:46:43,11,2,11,4017,31,4059
11273,2/11/2019 12:22:32 PM,Weedless,codeKameleon,1.42,51,7,7,7,7,1,2019-02-11 12:22:32,11,2,11,4017,31,4059
11272,2/11/2019 7:35:30 AM,Mr Blue,codeKameleon,1.8,32,6,6,6,6,0,2019-02-11 07:35:30,11,2,11,4017,31,4059
11271,2/11/2019 7:15:17 AM,Impawssible,codeKameleon,1.75,75,8,8,8,19,0,2019-02-11 07:15:17,11,2,11,4017,31,4059
11270,2/8/2019 7:58:18 PM,Dual purpose (Version 2),drmazhar,2.56,19,9,9,9,10,0,2019-02-08 19:58:18,11,2,8,4017,31,4056
11269,2/8/2019 1:38:20 PM,19,codeKameleon,1.67,28,9.3928571429,9,9,5,1,2019-02-08 13:38:20,11,2,8,4017,31,4056
11268,2/8/2019 9:16:59 AM,!trafficLaws,codeKameleon,1.38,52,5.5576923077,6,5,6,4,2019-02-08 09:16:59,11,2,8,4017,31,4056
11267,2/6/2019 9:50:44 AM,Langton's 2:1 Ant,jnpollack,2.75,6,10,10,10,1,0,2019-02-06 09:50:44,11,2,6,4017,31,4054
11266,2/1/2019 11:26:46 PM,Double Red Dead End,jnpollack,3.08,21,10.6666666667,11,10,13,0,2019-02-01 23:26:46,11,2,1,4017,31,4049
11265,1/30/2019 1:34:38 PM,Line to spiral (uncentered spring),scorpio,3,4,15.5,15,15,3,0,2019-01-30 13:34:38,11,1,30,4017,0,4047
11264,1/30/2019 6:57:47 AM,Addresses (Version 2),drmazhar,3,8,25.25,27,21,4,0,2019-01-30 06:57:47,11,1,30,4017,0,4047
11263,1/29/2019 6:35:57 PM,Addresses,drmazhar,3.2,9,12.2222222222,12,11,5,0,2019-01-29 18:35:57,11,1,29,4017,0,4046
11262,1/29/2019 10:10:14 AM,rgb allstars,codeKameleon,1.62,35,12,12,12,6,1,2019-01-29 10:10:14,11,1,29,4017,0,4046
11261,1/29/2019 3:50:27 AM,Robin,codeKameleon,2.14,44,6,6,6,14,0,2019-01-29 03:50:27,11,1,29,4017,0,4046
11260,1/28/2019 3:27:04 PM,Bloody Middle,codeKameleon,1.44,51,7,7,7,7,2,2019-01-28 15:27:04,11,1,28,4017,0,4045
11259,1/28/2019 2:16:16 PM,Donnie Splatoon,codeKameleon,1.37,93,6,6,6,10,1,2019-01-28 14:16:16,11,1,28,4017,0,4045
11258,1/28/2019 10:33:27 AM,42 - 3,codeKameleon,1.53,48,5,5,5,7,2,2019-01-28 10:33:27,11,1,28,4017,0,4045
11257,1/27/2019 11:12:00 AM,harder puzzle,MathiasLipko,1.62,42,5,5,5,8,1,2019-01-27 11:12:00,11,1,27,4017,0,4044
11256,1/26/2019 7:24:46 PM,Red inside blue,aja2718,2.33,8,11,11,11,4,1,2019-01-26 19:24:46,11,1,26,4017,0,4043
11255,1/25/2019 1:17:00 PM,"Five Sevens ""77777""",drmazhar,2.75,6,29.5,0,29,3,0,2019-01-25 13:17:00,11,1,25,4017,0,4042
11254,1/22/2019 9:28:21 PM,Reflection III,drmazhar,3,5,25.2,25,23,3,0,2019-01-22 21:28:21,11,1,22,4017,0,4039
11253,1/21/2019 3:22:13 AM,Cycle to spiral,scorpio,4,2,16,0,15,1,0,2019-01-21 03:22:13,11,1,21,4017,0,4038
11252,1/19/2019 2:10:28 PM,Replication Engine 14,drmazhar,3.5,8,26.875,28,25,4,0,2019-01-19 14:10:28,11,1,19,4017,0,4036
11251,1/18/2019 4:26:11 AM,Delay  while Pushing and Poping,drmazhar,2.33,7,12.2857142857,12,12,2,0,2019-01-18 04:26:11,11,1,18,4017,0,4035
11250,1/16/2019 9:52:32 PM,Painting delay,scorpio,2.69,24,7,7,7,14,0,2019-01-16 21:52:32,11,1,16,4017,0,4033
11249,1/16/2019 4:15:57 PM,Floors & Distances,drmazhar,3,6,18.8333333333,20,15,1,0,2019-01-16 16:15:57,11,1,16,4017,0,4033
11248,1/15/2019 7:04:56 AM,Down and up (Version 2),drmazhar,2.5,9,17.7777777778,18,16,3,0,2019-01-15 07:04:56,11,1,15,4017,0,4032
11247,1/14/2019 7:29:38 PM,Down then Up,drmazhar,2.47,28,10.8214285714,11,9,13,0,2019-01-14 19:29:38,11,1,14,4017,0,4031
11246,1/13/2019 3:58:17 PM,Get the address  (Version 13),drmazhar,3.33,5,22.8,23,22,3,0,2019-01-13 15:58:17,11,1,13,4017,0,4030
11245,1/12/2019 4:21:35 PM,Animals Fight for a Treat,jnpollack,3.67,4,13,13,12,2,0,2019-01-12 16:21:35,11,1,12,4017,0,4029
11244,1/11/2019 10:04:33 PM,Multiple stacks in one function (Lite edition),scorpio,3.71,11,7.1818181818,7,7,6,0,2019-01-11 22:04:33,11,1,11,4017,0,4028
11243,1/11/2019 2:45:07 AM,Multiple stacks in one function III,scorpio,4,5,8.2,8,8,3,0,2019-01-11 02:45:07,11,1,11,4017,0,4028
11242,1/10/2019 1:27:18 PM,Double Counting (Version 2),drmazhar,3.5,3,19.6666666667,19,19,1,0,2019-01-10 13:27:18,11,1,10,4017,0,4027
11241,1/10/2019 12:15:27 PM,Exceeded Quota,jnpollack,3.2,6,16.5,16,16,4,0,2019-01-10 12:15:27,11,1,10,4017,0,4027
11240,1/10/2019 1:42:09 AM,Multiple stacks in one function II,scorpio,4,4,8,8,8,2,0,2019-01-10 01:42:09,11,1,10,4017,0,4027
11239,1/9/2019 11:37:37 PM,Twisted Hourglass,jnpollack,3.25,5,18.8,19,18,3,0,2019-01-09 23:37:37,11,1,9,4017,0,4026
11238,1/9/2019 8:44:30 PM,Inchworm on a Stick,jnpollack,3,2,15.5,0,15,0,0,2019-01-09 20:44:30,11,1,9,4017,0,4026
11236,1/9/2019 1:31:41 PM,Hierarchy,jnpollack,3.67,5,15,15,15,2,0,2019-01-09 13:31:41,11,1,9,4017,0,4026
11234,1/8/2019 6:36:05 PM,Multiple stacks in one function,scorpio,4.33,5,10,10,10,3,0,2019-01-08 18:36:05,11,1,8,4017,0,4025
11233,1/7/2019 2:42:35 PM,Order of Operations,axorion,3,7,14,14,14,5,0,2019-01-07 14:42:35,11,1,7,4017,0,4024
11232,1/6/2019 11:19:58 PM,Choose your turn II,scorpio,3.5,4,12.5,12,12,3,0,2019-01-06 23:19:58,11,1,6,4017,0,4023
11231,1/6/2019 6:55:11 PM,Overlapping Hs,jnpollack,3,2,24,24,24,0,0,2019-01-06 18:55:11,11,1,6,4017,0,4023
11230,1/6/2019 4:51:45 PM,Catch the colour ( Version 2 ),drmazhar,2.6,8,16.625,13,13,1,0,2019-01-06 16:51:45,11,1,6,4017,0,4023
11229,1/5/2019 6:08:40 PM,Copy then Paste (Version 3),drmazhar,2.14,14,8,8,8,6,1,2019-01-05 18:08:40,11,1,5,4017,0,4022
11228,1/4/2019 4:17:41 PM,Perimeter Stations 3,jnpollack,4,7,8,8,8,1,0,2019-01-04 16:17:41,11,1,4,4017,0,4021
11227,1/4/2019 3:47:52 PM,Perimeter Stations 2,jnpollack,2,8,8,8,8,0,2,2019-01-04 15:47:52,11,1,4,4017,0,4021
11226,1/4/2019 3:41:30 PM,Perimeter Stations 1,jnpollack,1.92,26,13,13,13,4,2,2019-01-04 15:41:30,11,1,4,4017,0,4021
11225,1/3/2019 4:49:49 PM,Divisible by 1 or 2 or 3,drmazhar,2.75,5,19.8,0,17,3,0,2019-01-03 16:49:49,11,1,3,4017,0,4020
11224,1/2/2019 7:54:59 AM,Accumulation,axorion,4,5,13.2,13,13,3,0,2019-01-02 07:54:59,11,1,2,4017,0,4019
11223,1/1/2019 6:41:56 PM,Scales of Justice (Version 2),drmazhar,2.13,15,8.8666666667,8,8,7,1,2019-01-01 18:41:56,11,1,1,4017,0,4018
11222,12/31/2018 6:52:43 PM,2019 (Happy New Year),drmazhar,4,3,19,18,18,2,0,2018-12-31 18:52:43,10,12,31,3652,334,4017
11221,12/31/2018 2:19:06 PM,New Year Tree,scorpio,2.5,7,14.8571428571,14,14,3,1,2018-12-31 14:19:06,10,12,31,3652,334,4017
11220,12/31/2018 2:08:58 AM,Snowflake coloration III,scorpio,4,2,12.5,0,11,1,0,2018-12-31 02:08:58,10,12,31,3652,334,4017
11219,12/31/2018 1:58:27 AM,This One Goes to 11.,setnado,2.5,9,8,8,8,5,0,2018-12-31 01:58:27,10,12,31,3652,334,4017
11218,12/30/2018 10:56:08 PM,Snowflake coloration II,scorpio,3,7,13.8571428571,14,13,5,0,2018-12-30 22:56:08,10,12,30,3652,334,4016
11217,12/30/2018 10:41:23 PM,Snowflake coloration,scorpio,3,3,8,8,8,1,0,2018-12-30 22:41:23,10,12,30,3652,334,4016
11216,12/30/2018 3:52:38 PM,Paint the Snowflake,jnpollack,2.13,13,7,7,7,4,1,2018-12-30 15:52:38,10,12,30,3652,334,4016
11215,12/29/2018 4:43:35 PM,Moving Green,drmazhar,3,2,22,0,20,1,0,2018-12-29 16:43:35,10,12,29,3652,334,4015
11214,12/29/2018 3:47:18 PM,Scales of Justice,scorpio,4,6,29.3333333333,29,29,2,0,2018-12-29 15:47:18,10,12,29,3652,334,4015
11213,12/29/2018 1:45:22 AM,The Justice,drmazhar,3.67,3,35.3333333333,0,32,1,0,2018-12-29 01:45:22,10,12,29,3652,334,4015
11212,12/29/2018 1:07:11 AM,Passing the Torch,jnpollack,3.5,3,28,0,24,1,0,2018-12-29 01:07:11,10,12,29,3652,334,4015
11210,12/27/2018 6:10:22 PM,Fill ice rinks II,scorpio,3,4,8.25,8,7,2,0,2018-12-27 18:10:22,10,12,27,3652,334,4013
11209,12/27/2018 4:07:15 PM,Fill ice rinks,scorpio,3,3,14,15,12,1,0,2018-12-27 16:07:15,10,12,27,3652,334,4013
11208,12/27/2018 1:45:40 PM,Crawl and Fall 2,jnpollack,2.5,5,16.6,17,16,4,0,2018-12-27 13:45:40,10,12,27,3652,334,4013
11207,12/27/2018 11:07:59 AM,Ex 2 - 1,logicminds,1,9,8,8,8,0,5,2018-12-27 11:07:59,10,12,27,3652,334,4013
11206,12/27/2018 11:04:19 AM,Ex 2 - 4,logicminds,1.14,16,11.5,11,11,1,6,2018-12-27 11:04:19,10,12,27,3652,334,4013
11205,12/27/2018 10:57:49 AM,Ex 2 - 3,logicminds,1,10,7.1,6,6,0,5,2018-12-27 10:57:49,10,12,27,3652,334,4013
11204,12/27/2018 10:55:14 AM,Ex 2 - 2,logicminds,1,10,6.8,6,6,0,5,2018-12-27 10:55:14,10,12,27,3652,334,4013
11203,12/27/2018 10:30:12 AM,teste,logicminds,1,16,6,6,6,1,6,2018-12-27 10:30:12,10,12,27,3652,334,4013
11201,12/26/2018 11:52:50 PM,the shadow,drmazhar,2.86,11,9.8181818182,10,9,5,0,2018-12-26 23:52:50,10,12,26,3652,334,4012
11200,12/26/2018 2:18:05 PM,Crawl and Fall,jnpollack,2.83,6,13,15,10,4,0,2018-12-26 14:18:05,10,12,26,3652,334,4012
11199,12/25/2018 11:06:32 AM,kind of Towers,drmazhar,2.25,6,21,0,17,2,0,2018-12-25 11:06:32,10,12,25,3652,334,4011
11198,12/24/2018 4:11:46 PM,Grinch Star,jnpollack,3,2,11,11,11,0,0,2018-12-24 16:11:46,10,12,24,3652,334,4010
11197,12/24/2018 6:35:54 AM,Christmas Wreath,axorion,3,5,8,8,8,1,0,2018-12-24 06:35:54,10,12,24,3652,334,4010
11196,12/23/2018 12:19:46 AM,Linked list 9,drmazhar,3.5,5,18.8,19,18,2,0,2018-12-23 00:19:46,10,12,23,3652,334,4009
11195,12/22/2018 11:57:50 AM,ZigZag Counting,drmazhar,2.67,21,12,12,12,9,0,2018-12-22 11:57:50,10,12,22,3652,334,4008
11194,12/21/2018 9:34:28 AM,Abnormal,drmazhar,3,3,21.6666666667,0,19,1,0,2018-12-21 09:34:28,10,12,21,3652,334,4007
11193,12/21/2018 4:01:00 AM,Sum of Greens,drmazhar,2.12,32,9,9,9,7,1,2018-12-21 04:01:00,10,12,21,3652,334,4007
11192,12/20/2018 12:56:19 PM,Puzzle #1,jdicarlo,1.46,41,11.5609756098,12,8,8,3,2018-12-20 12:56:19,10,12,20,3652,334,4006
11191,12/20/2018 6:04:32 AM,Extreme Expansion,aja2718,4,2,9.5,0,9,1,1,2018-12-20 06:04:32,10,12,20,3652,334,4006
11184,12/19/2018 8:30:09 PM,Diamond Growth,aja2718,2.6,7,7.4285714286,7,7,2,1,2018-12-19 20:30:09,10,12,19,3652,334,4005
11183,12/19/2018 4:33:22 PM,Colour Separtion (Version 2),drmazhar,3,6,22,0,21,2,0,2018-12-19 16:33:22,10,12,19,3652,334,4005
11182,12/19/2018 5:52:13 AM,Colour Separation,drmazhar,4,2,26.5,0,25,1,0,2018-12-19 05:52:13,10,12,19,3652,334,4005
11181,12/18/2018 8:57:31 PM,Small Square = Small Solution,aja2718,2.08,24,5.125,5,5,7,1,2018-12-18 20:57:31,10,12,18,3652,334,4004
11180,12/18/2018 2:12:25 PM,Big Wheel,axorion,3,3,16,16,16,1,0,2018-12-18 14:12:25,10,12,18,3652,334,4004
11179,12/17/2018 8:46:15 PM,Upsizing Engine (Version 10),drmazhar,3,6,13,13,13,4,0,2018-12-17 20:46:15,10,12,17,3652,334,4003
11178,12/17/2018 5:41:27 PM,Octagonal Wheel 2,aja2718,2,6,12.3333333333,0,8,3,1,2018-12-17 17:41:27,10,12,17,3652,334,4003
11177,12/17/2018 5:11:19 AM,Beachcombing,axorion,3.36,16,10,10,10,11,0,2018-12-17 05:11:19,10,12,17,3652,334,4003
11176,12/16/2018 3:20:08 PM,Thick stack,scorpio,3,6,13.5,0,13,3,0,2018-12-16 15:20:08,10,12,16,3652,334,4002
11175,12/16/2018 1:40:35 PM,Octagonal Wheel,aja2718,2.5,12,10.5,0,10,6,1,2018-12-16 13:40:35,10,12,16,3652,334,4002
11174,12/16/2018 8:06:30 AM,hard stack,neenthewiser,1.75,29,5,5,5,8,1,2018-12-16 08:06:30,10,12,16,3652,334,4002
11173,12/16/2018 5:28:32 AM,Map of Greens & Blues,drmazhar,2.67,4,15.5,0,12,2,0,2018-12-16 05:28:32,10,12,16,3652,334,4002
11172,12/15/2018 1:33:22 PM,753 got hacked,jnpollack,3,2,10,10,10,0,0,2018-12-15 13:33:22,10,12,15,3652,334,4001
11171,12/15/2018 12:41:30 PM,Bloodlust,aja2718,2.22,13,6.3846153846,6,6,5,1,2018-12-15 12:41:30,10,12,15,3652,334,4001
11170,12/15/2018 1:14:25 AM,Filter (Version 3),drmazhar,1.67,28,18.8571428571,18,14,6,1,2018-12-15 01:14:25,10,12,15,3652,334,4001
11169,12/14/2018 2:42:30 PM,Tree with red ends,scorpio,3.4,6,23.1666666667,23,21,5,0,2018-12-14 14:42:30,10,12,14,3652,334,4000
11168,12/14/2018 2:25:22 AM,Waterfalls III,scorpio,5,3,33,33,33,2,0,2018-12-14 02:25:22,10,12,14,3652,334,4000
11167,12/14/2018 2:24:20 AM,Waterfalls II,scorpio,4,4,28,0,26,3,0,2018-12-14 02:24:20,10,12,14,3652,334,4000
11166,12/13/2018 2:17:47 PM,Another Reflection control,drmazhar,3.33,4,24,24,24,2,0,2018-12-13 14:17:47,10,12,13,3652,334,3999
11165,12/13/2018 7:16:51 AM,simple stack 2,neenthewiser,1.67,45,9.8222222222,10,9,8,1,2018-12-13 07:16:51,10,12,13,3652,334,3999
11164,12/13/2018 6:40:11 AM,simple stack 3,neenthewiser,1.5,53,6,6,6,6,5,2018-12-13 06:40:11,10,12,13,3652,334,3999
11163,12/12/2018 4:25:07 PM,Ternary tree,scorpio,2.93,26,8.7692307692,9,8,17,0,2018-12-12 16:25:07,10,12,12,3652,334,3998
11162,12/12/2018 7:31:08 AM,RGBF3,axorion,3.5,6,16.5,0,16,3,0,2018-12-12 07:31:08,10,12,12,3652,334,3998
11161,12/11/2018 7:45:39 PM,The Guide (Version 5),drmazhar,2.83,10,12,12,12,5,0,2018-12-11 19:45:39,10,12,11,3652,334,3997
11160,12/11/2018 7:06:47 PM,Linked List 8,drmazhar,3.5,3,24.3333333333,0,21,1,0,2018-12-11 19:06:47,10,12,11,3652,334,3997
11159,12/11/2018 3:04:31 PM,Ternary tree copy II,scorpio,5,2,22,22,22,1,0,2018-12-11 15:04:31,10,12,11,3652,334,3997
11158,12/11/2018 2:21:43 PM,Ternary tree copy,scorpio,4,2,14,14,14,1,0,2018-12-11 14:21:43,10,12,11,3652,334,3997
11157,12/11/2018 12:15:13 AM,Half Baked,axorion,2.33,8,15,15,15,5,0,2018-12-11 00:15:13,10,12,11,3652,334,3997
11156,12/10/2018 7:01:29 PM,Designing a puzzle,NeddlesKing,1.64,33,8,8,8,7,3,2018-12-10 19:01:29,10,12,10,3652,334,3996
11155,12/10/2018 6:28:23 AM,Simple Stack 1,neenthewiser,1.73,52,7,7,7,8,2,2018-12-10 06:28:23,10,12,10,3652,334,3996
11154,12/10/2018 3:41:31 AM,Good Will,axorion,4,2,21,21,21,0,0,2018-12-10 03:41:31,10,12,10,3652,334,3996
11153,12/9/2018 4:22:45 PM,Attraction and Repulsion,aja2718,4,4,9.25,9,9,3,1,2018-12-09 16:22:45,10,12,9,3652,334,3995
11152,12/9/2018 11:05:13 AM,Incomprehensible,axorion,3.5,3,26.3333333333,26,26,1,0,2018-12-09 11:05:13,10,12,9,3652,334,3995
11151,12/9/2018 8:41:14 AM,Stranger Than Stranger Than The Strangest Shape,aja2718,4,1,13,13,13,1,0,2018-12-09 08:41:14,10,12,9,3652,334,3995
11150,12/9/2018 8:13:13 AM,Stranger Than the Strangest Shape,aja2718,4,1,15,15,15,1,0,2018-12-09 08:13:13,10,12,9,3652,334,3995
11149,12/8/2018 11:14:26 PM,Karma,axorion,4,2,27.5,0,27,0,0,2018-12-08 23:14:26,10,12,8,3652,334,3994
11148,12/8/2018 4:06:48 PM,Just a relaxing little thing,aja2718,1.62,33,10.8787878788,10,10,7,3,2018-12-08 16:06:48,10,12,8,3652,334,3994
11146,12/8/2018 3:25:59 PM,Cross Wiggling,aja2718,1.9,21,11.7619047619,11,10,8,2,2018-12-08 15:25:59,10,12,8,3652,334,3994
11145,12/8/2018 3:17:16 PM,The Strangest Shape,aja2718,4,1,14,14,14,1,0,2018-12-08 15:17:16,10,12,8,3652,334,3994
11144,12/8/2018 10:07:41 AM,Catch the color,drmazhar,2.2,21,12,12,12,8,0,2018-12-08 10:07:41,10,12,8,3652,334,3994
11143,12/8/2018 3:18:54 AM,stack then bruteforce,neenthewiser,2,20,18.3,18,16,6,1,2018-12-08 03:18:54,10,12,8,3652,334,3994
11142,12/7/2018 8:09:37 AM,Core,axorion,3,2,29,0,28,1,0,2018-12-07 08:09:37,10,12,7,3652,334,3993
11141,12/6/2018 3:05:38 PM,Filling a square,scorpio,4.5,3,9,9,9,2,0,2018-12-06 15:05:38,10,12,6,3652,334,3992
11140,12/4/2018 10:43:53 PM,puzzle no.3 ENGR 100 II,drmazhar,3,7,9.1428571429,9,9,3,0,2018-12-04 22:43:53,10,12,4,3652,334,3990
11139,12/4/2018 2:46:51 PM,Linked list 7,drmazhar,3.75,6,17.6666666667,0,14,4,0,2018-12-04 14:46:51,10,12,4,3652,334,3990
11138,12/4/2018 6:36:31 AM,Half on reverse,drmazhar,3,4,17,17,17,1,0,2018-12-04 06:36:31,10,12,4,3652,334,3990
11136,12/2/2018 10:25:39 PM,Primed For Failure,axorion,4,2,32,32,32,1,0,2018-12-02 22:25:39,10,12,2,3652,334,3988
11133,12/1/2018 6:48:17 AM,Polished Gravel,axorion,3,5,27,27,27,2,0,2018-12-01 06:48:17,10,12,1,3652,334,3987
11132,11/30/2018 7:43:10 PM,Forever Trunk,ZorkonZorba,1.36,49,6.9183673469,6,6,8,4,2018-11-30 19:43:10,10,11,30,3652,304,3986
11131,11/30/2018 7:31:49 PM,Two and One,aja2718,3.33,3,11.6666666667,12,11,2,0,2018-11-30 19:31:49,10,11,30,3652,304,3986
11130,11/30/2018 7:30:30 PM,ENGR 100 the 5TH,yash7,1.38,40,4.05,4,4,5,3,2018-11-30 19:30:30,10,11,30,3652,304,3986
11129,11/30/2018 7:08:18 PM,Combination Puzzle,AynaJain,1.21,127,5,5,5,27,11,2018-11-30 19:08:18,10,11,30,3652,304,3986
11128,11/30/2018 6:13:12 PM,Cubic Zirconia II,drmazhar,3,5,26.2,27,25,1,0,2018-11-30 18:13:12,10,11,30,3652,304,3986
11127,11/30/2018 5:47:29 PM,*SELECTION*,robozzle01,1.5,37,5.0540540541,5,5,6,3,2018-11-30 17:47:29,10,11,30,3652,304,3986
11126,11/30/2018 5:47:09 PM,Spiral-ly II,drmazhar,2.09,20,8,8,8,5,0,2018-11-30 17:47:09,10,11,30,3652,304,3986
11125,11/30/2018 4:38:48 PM,Let let let us in - like a salad bowl,ENGR1002345,2.4,7,8,8,8,3,1,2018-11-30 16:38:48,10,11,30,3652,304,3986
11124,11/30/2018 4:25:31 PM,This is Iteration,AynaJain,1.29,75,5.52,4,4,10,6,2018-11-30 16:25:31,10,11,30,3652,304,3986
11123,11/30/2018 4:16:27 PM,This is Selection,AynaJain,1.62,56,8.625,8,7,3,5,2018-11-30 16:16:27,10,11,30,3652,304,3986
11122,11/30/2018 4:01:36 PM,hola,itnaspecific,1.36,41,17.8048780488,15,15,5,3,2018-11-30 16:01:36,10,11,30,3652,304,3986
11121,11/30/2018 3:55:58 PM,puzzle 4th ENGR 100,yash7,1.29,57,5.1228070175,5,5,7,4,2018-11-30 15:55:58,10,11,30,3652,304,3986
11120,11/30/2018 3:46:15 PM,Simple Selection,ENGR1002345,1.73,27,7.0740740741,6,6,5,3,2018-11-30 15:46:15,10,11,30,3652,304,3986
11119,11/30/2018 3:45:53 PM,GO AROUND,AynaJain,1.5,37,7.0810810811,5,5,5,3,2018-11-30 15:45:53,10,11,30,3652,304,3986
11118,11/30/2018 3:38:00 PM,puzzle no.3 ENGR 100,yash7,1.42,42,5.0476190476,5,5,5,5,2018-11-30 15:38:00,10,11,30,3652,304,3986
11117,11/30/2018 3:25:11 PM,2nd puzzle ENGR 100,yash7,1.27,63,6.2222222222,7,5,9,5,2018-11-30 15:25:11,10,11,30,3652,304,3986
11116,11/30/2018 3:06:29 PM,puzzle 1 ENGR100,yash7,1.09,367,5.408719346,4,4,76,24,2018-11-30 15:06:29,10,11,30,3652,304,3986
11115,11/30/2018 2:30:37 PM,Yes - Use All Spaces,ENGR1002345,1.6,26,17.5,16,15,3,3,2018-11-30 14:30:37,10,11,30,3652,304,3986
11114,11/30/2018 1:54:15 PM,The Swap,CandyApples,1.5,36,8.25,8,8,5,3,2018-11-30 13:54:15,10,11,30,3652,304,3986
11113,11/30/2018 1:46:49 PM,What does DNA stand for?,ENGR1002345,1.64,32,6.9375,7,6,3,5,2018-11-30 13:46:49,10,11,30,3652,304,3986
11111,11/30/2018 12:31:05 PM,11111,scorpio,3.75,9,18.1111111111,0,16,3,0,2018-11-30 12:31:05,10,11,30,3652,304,3986
11110,11/30/2018 12:30:22 PM,why be a king when you could be god,itnaspecific,1.36,82,6,6,6,14,8,2018-11-30 12:30:22,10,11,30,3652,304,3986
11109,11/30/2018 12:21:14 PM,thaliva,itnaspecific,1,13,4,4,4,1,6,2018-11-30 12:21:14,10,11,30,3652,304,3986
11108,11/30/2018 12:15:03 PM,ab ye karke dekhao,itnaspecific,1.89,21,14.380952381,15,12,4,3,2018-11-30 12:15:03,10,11,30,3652,304,3986
11107,11/30/2018 11:59:47 AM,BoxToBox,TeriMaaKa,1.31,92,5,5,5,18,5,2018-11-30 11:59:47,10,11,30,3652,304,3986
11106,11/30/2018 11:24:06 AM,WOW,terimaaka,1.45,39,8.2307692308,8,8,6,2,2018-11-30 11:24:06,10,11,30,3652,304,3986
11105,11/30/2018 11:22:19 AM,2.Iteration(UIC),iMxM7,1.5,43,5,5,5,5,6,2018-11-30 11:22:19,10,11,30,3652,304,3986
11104,11/30/2018 11:07:36 AM,Selection AS,engr100project,1.29,63,5.380952381,5,5,11,5,2018-11-30 11:07:36,10,11,30,3652,304,3986
11103,11/30/2018 11:01:37 AM,Spiral-ly,KrustyCrew,1.54,34,4.9411764706,4,4,7,4,2018-11-30 11:01:37,10,11,30,3652,304,3986
11102,11/30/2018 10:52:14 AM,3.Function calls(UIC),iMxM7,1.78,21,11.6666666667,10,10,3,1,2018-11-30 10:52:14,10,11,30,3652,304,3986
11101,11/30/2018 10:47:05 AM,Up and Around,gamers69,2.14,15,10.7333333333,12,9,5,1,2018-11-30 10:47:05,10,11,30,3652,304,3986
11100,11/30/2018 7:22:50 AM,Paste,axorion,3.8,7,29.8571428571,30,29,4,0,2018-11-30 07:22:50,10,11,30,3652,304,3986
11099,11/30/2018 7:02:35 AM,Cubic Zirconia,axorion,4,7,23.2857142857,23,23,4,0,2018-11-30 07:02:35,10,11,30,3652,304,3986
11098,11/30/2018 4:41:00 AM,Walk the Halls,fesp2018fall,2,20,14.3,12,12,6,1,2018-11-30 04:41:00,10,11,30,3652,304,3986
11096,11/30/2018 2:09:32 AM,Switch Iteration,KrustyCrew,1.36,53,4,4,4,4,5,2018-11-30 02:09:32,10,11,30,3652,304,3986
11084,11/30/2018 1:23:34 AM,Ring,uiccs2018,1.19,107,6.5794392523,6,6,17,11,2018-11-30 01:23:34,10,11,30,3652,304,3986
11083,11/30/2018 1:17:56 AM,easy for beginners,itnaspecific,1.69,31,10.4838709677,7,7,4,5,2018-11-30 01:17:56,10,11,30,3652,304,3986
11082,11/30/2018 12:42:09 AM,Iteration Tangled,zjsengr100,1.5,34,10.0294117647,10,9,5,4,2018-11-30 00:42:09,10,11,30,3652,304,3986
11081,11/30/2018 12:41:29 AM,S,terimaaka,1.58,34,8.2352941176,8,7,8,2,2018-11-30 00:41:29,10,11,30,3652,304,3986
11080,11/30/2018 12:17:46 AM,Selection e,zjsengr100,1.8,23,11.1304347826,11,11,5,3,2018-11-30 00:17:46,10,11,30,3652,304,3986
11079,11/30/2018 12:03:32 AM,YMCA,RubberDucky,2,18,15.4444444444,12,12,5,2,2018-11-30 00:03:32,10,11,30,3652,304,3986
11078,11/29/2018 11:49:25 PM,Selection Worm,RubberDucky,1.78,23,12.4347826087,13,9,4,3,2018-11-29 23:49:25,10,11,29,3652,304,3985
11077,11/29/2018 11:46:56 PM,Function Cinnamon Bun,zjsengr100,1.55,36,11.8055555556,12,10,5,4,2018-11-29 23:46:56,10,11,29,3652,304,3985
11076,11/29/2018 11:29:38 PM,Combination 2,zjsengr100,2.67,11,15.0909090909,16,13,3,1,2018-11-29 23:29:38,10,11,29,3652,304,3985
11075,11/29/2018 10:57:32 PM,engrrr 100,robozzled9000,1.17,108,8.5,10,5,15,7,2018-11-29 22:57:32,10,11,29,3652,304,3985
11074,11/29/2018 10:37:34 PM,Mario,zjsengr100,1.17,88,6.9886363636,5,5,12,10,2018-11-29 22:37:34,10,11,29,3652,304,3985
11073,11/29/2018 10:31:53 PM,4,iMxM7,2.11,16,7.875,7,7,5,1,2018-11-29 22:31:53,10,11,29,3652,304,3985
11072,11/29/2018 10:12:59 PM,Iteration,groupproject_1,1.43,41,9.243902439,9,9,5,4,2018-11-29 22:12:59,10,11,29,3652,304,3985
11071,11/29/2018 10:09:51 PM,Zig Zag YOYO,RubberDucky,1.62,33,8,8,8,6,3,2018-11-29 22:09:51,10,11,29,3652,304,3985
11070,11/29/2018 10:00:27 PM,Loop,UICejj,1,22,6,6,6,2,7,2018-11-29 22:00:27,10,11,29,3652,304,3985
11069,11/29/2018 9:23:38 PM,Green Loops,RubberDucky,2.33,14,23.5,0,15,5,1,2018-11-29 21:23:38,10,11,29,3652,304,3985
11068,11/29/2018 9:13:53 PM,Crossroads,RubberDucky,1.46,46,5,5,5,7,3,2018-11-29 21:13:53,10,11,29,3652,304,3985
11067,11/29/2018 9:11:15 PM,Slalom,robozzled9000,1.58,32,11,9,6,5,3,2018-11-29 21:11:15,10,11,29,3652,304,3985
11066,11/29/2018 8:00:44 PM,3. fucntion call,imxm7,2,40,10.875,8,8,12,0,2018-11-29 20:00:44,10,11,29,3652,304,3985
11065,11/29/2018 7:37:11 PM,When to turn?,fesp2018fall,1.8,23,6.2608695652,6,6,3,5,2018-11-29 19:37:11,10,11,29,3652,304,3985
11064,11/29/2018 7:29:29 PM,1.Selection(UIC),iMxM7,1.24,107,9.2429906542,10,5,12,6,2018-11-29 19:29:29,10,11,29,3652,304,3985
11063,11/29/2018 7:04:24 PM,Iteration+Function Call,ENGR1002345,1.5,38,7,7,7,5,4,2018-11-29 19:04:24,10,11,29,3652,304,3985
11062,11/29/2018 7:02:35 PM,Selection(engr100),robozzled9000,3.5,11,6,6,6,5,1,2018-11-29 19:02:35,10,11,29,3652,304,3985
11061,11/29/2018 5:42:13 PM,Paperclip,uiccs2018,1.29,66,5.5454545455,5,5,7,8,2018-11-29 17:42:13,10,11,29,3652,304,3985
11060,11/29/2018 5:41:56 PM,Iteration 1000,robozzled9000,1.33,41,4.487804878,4,4,5,10,2018-11-29 17:41:56,10,11,29,3652,304,3985
11059,11/29/2018 5:40:29 PM,Iteration 1000,robozzled9000,1.15,185,4.4324324324,4,4,22,19,2018-11-29 17:40:29,10,11,29,3652,304,3985
11058,11/29/2018 5:30:16 PM,Confusing Roads,fesp2018fall,3,8,14.375,14,13,2,0,2018-11-29 17:30:16,10,11,29,3652,304,3985
11057,11/29/2018 5:29:55 PM,Selection,SAA100,1.57,35,10.9428571429,10,5,3,4,2018-11-29 17:29:55,10,11,29,3652,304,3985
11056,11/29/2018 5:25:00 PM,Function call+selection,SAA100,2.75,6,8,0,6,2,1,2018-11-29 17:25:00,10,11,29,3652,304,3985
11055,11/29/2018 5:22:49 PM,UIC_ENGR_100,KrustyCrew,1.32,85,6.3764705882,5,5,14,7,2018-11-29 17:22:49,10,11,29,3652,304,3985
11054,11/29/2018 5:21:27 PM,candy apple,CandyApples,2,18,6,6,6,4,2,2018-11-29 17:21:27,10,11,29,3652,304,3985
11053,11/29/2018 5:18:51 PM,Function Call,ZorkonZorba,1.82,23,6.5217391304,6,6,6,1,2018-11-29 17:18:51,10,11,29,3652,304,3985
11052,11/29/2018 5:17:58 PM,Swan,uicejj,2.2,19,6.6842105263,7,6,6,2,2018-11-29 17:17:58,10,11,29,3652,304,3985
11051,11/29/2018 5:11:16 PM,Five Carat,axorion,3.33,5,25,25,25,3,0,2018-11-29 17:11:16,10,11,29,3652,304,3985
11050,11/29/2018 5:02:02 PM,Snake,uicejj,1.42,41,5,5,5,4,4,2018-11-29 17:02:02,10,11,29,3652,304,3985
11049,11/29/2018 5:01:20 PM,Loop,UicEJJ,1.89,22,7.3636363636,0,6,6,1,2018-11-29 17:01:20,10,11,29,3652,304,3985
11048,11/29/2018 4:53:35 PM,Selection and Iteration,gamers69,1.5,37,4.8108108108,4,4,6,2,2018-11-29 16:53:35,10,11,29,3652,304,3985
11047,11/29/2018 4:49:00 PM,iteration and selection,uiceng100,1.25,73,7.6849315068,7,6,11,5,2018-11-29 16:49:00,10,11,29,3652,304,3985
11046,11/29/2018 4:46:02 PM,Ryabko,dmmn,1.88,19,16.7894736842,17,13,5,1,2018-11-29 16:46:02,10,11,29,3652,304,3985
11045,11/29/2018 4:45:08 PM,Selection Puzzle,dmmn,1.36,52,8.0576923077,8,8,4,5,2018-11-29 16:45:08,10,11,29,3652,304,3985
11044,11/29/2018 4:40:28 PM,Iteration,gamers69,1.67,27,8.0740740741,10,5,3,2,2018-11-29 16:40:28,10,11,29,3652,304,3985
11043,11/29/2018 4:39:34 PM,ENGR 100 Selection,gamers69,3.2,6,10.8333333333,11,10,4,0,2018-11-29 16:39:34,10,11,29,3652,304,3985
11042,11/29/2018 4:27:37 PM,selection and function calling,uiceng100,1.8,24,7.9583333333,8,7,3,5,2018-11-29 16:27:37,10,11,29,3652,304,3985
11041,11/29/2018 4:02:06 PM,Red and green,psef2018,1.86,14,19.1428571429,0,14,3,2,2018-11-29 16:02:06,10,11,29,3652,304,3985
11040,11/29/2018 3:46:10 PM,Complex Problem,dmmn,1.86,19,12.7894736842,14,9,2,2,2018-11-29 15:46:10,10,11,29,3652,304,3985
11039,11/29/2018 3:36:45 PM,Iteration (with some function calls),fespbois,1.58,33,11,12,9,3,3,2018-11-29 15:36:45,10,11,29,3652,304,3985
11038,11/29/2018 3:25:59 PM,Iteratingz,psef2018,1.29,79,9,9,9,11,5,2018-11-29 15:25:59,10,11,29,3652,304,3985
11037,11/29/2018 3:25:39 PM,"5 Moves, Lots of Stars (Challenging)",psef2018,1.3,29,4.0344827586,4,4,4,9,2018-11-29 15:25:39,10,11,29,3652,304,3985
11036,11/29/2018 3:14:00 PM,Selection,psef2018,1.78,23,12.9565217391,13,10,5,1,2018-11-29 15:14:00,10,11,29,3652,304,3985
11035,11/29/2018 12:42:56 PM,FESP Iteration,ZorkonZorba,2.5,3,11,10,10,1,1,2018-11-29 12:42:56,10,11,29,3652,304,3985
11034,11/29/2018 12:40:43 PM,Challenge 1 v2,groupproject_1,1.75,21,12.9047619048,13,11,3,3,2018-11-29 12:40:43,10,11,29,3652,304,3985
11033,11/29/2018 12:33:12 PM,WayToPlus,TeriMaaKa,1.89,22,10.1363636364,11,8,5,2,2018-11-29 12:33:12,10,11,29,3652,304,3985
11032,11/29/2018 12:32:34 PM,Ayy yuh,dmmn,1.73,22,14.2727272727,15,10,7,1,2018-11-29 12:32:34,10,11,29,3652,304,3985
11031,11/29/2018 12:21:24 PM,GreenBoxRedBox,TeriMaaKa,1.92,28,11.2142857143,0,6,5,1,2018-11-29 12:21:24,10,11,29,3652,304,3985
11030,11/29/2018 12:05:54 PM,Bridge over water,uiccs2018,1.73,23,12.0434782609,14,6,5,1,2018-11-29 12:05:54,10,11,29,3652,304,3985
11029,11/29/2018 11:43:09 AM,EZ recursive function,fesp2018fall,1.64,36,9.4166666667,8,8,8,2,2018-11-29 11:43:09,10,11,29,3652,304,3985
11028,11/29/2018 11:31:47 AM,Mountain,csproject20,1.91,23,17.9565217391,11,11,4,2,2018-11-29 11:31:47,10,11,29,3652,304,3985
11027,11/29/2018 11:17:24 AM,EZ iteration,fesp2018fall,1.36,51,5,5,5,7,5,2018-11-29 11:17:24,10,11,29,3652,304,3985
11026,11/29/2018 10:27:10 AM,Function calls,fespbois,2,20,16.1,0,8,4,2,2018-11-29 10:27:10,10,11,29,3652,304,3985
11025,11/29/2018 10:00:23 AM,V and around square,Quotas,2.29,10,14.4,15,11,5,1,2018-11-29 10:00:23,10,11,29,3652,304,3985
11024,11/29/2018 4:05:31 AM,"""Significant"" challenge",dmmn,1.94,48,13.5416666667,14,11,11,0,2018-11-29 04:05:31,10,11,29,3652,304,3985
11023,11/29/2018 2:23:10 AM,Stream,UICejj,1.71,14,15.8571428571,18,12,3,1,2018-11-29 02:23:10,10,11,29,3652,304,3985
11022,11/29/2018 12:48:24 AM,Squares,CS_Team,2,22,7.9090909091,6,6,5,1,2018-11-29 00:48:24,10,11,29,3652,304,3985
11021,11/29/2018 12:26:10 AM,Iteration,cs_team,1.7,22,16.0909090909,0,11,6,2,2018-11-29 00:26:10,10,11,29,3652,304,3985
11020,11/29/2018 12:21:34 AM,4 Corners with a Question,admwuic,2,19,12.5263157895,12,12,6,1,2018-11-29 00:21:34,10,11,29,3652,304,3985
11019,11/29/2018 12:12:36 AM,Combo: Function and Selection,admwuic,2.2,6,16.1666666667,0,11,1,1,2018-11-29 00:12:36,10,11,29,3652,304,3985
11018,11/29/2018 12:12:11 AM,Selection,FESP200,1.33,49,7.8979591837,8,7,8,2,2018-11-29 00:12:11,10,11,29,3652,304,3985
11017,11/29/2018 12:09:21 AM,Function Call,admwuic,1.88,19,11,11,11,4,2,2018-11-29 00:09:21,10,11,29,3652,304,3985
11016,11/29/2018 12:05:19 AM,Selection & Iteration,cs_team,1.25,94,8.4042553191,7,6,20,6,2018-11-29 00:05:19,10,11,29,3652,304,3985
11015,11/29/2018 12:02:13 AM,Selection,admwuic,1.6,33,9.4242424242,8,8,5,3,2018-11-29 00:02:13,10,11,29,3652,304,3985
11014,11/28/2018 11:36:50 PM,colorful_track,gootipapa,2.67,6,16.3333333333,15,15,2,1,2018-11-28 23:36:50,10,11,28,3652,304,3984
11013,11/28/2018 11:21:33 PM,Pretty Simple,CandyApples,1.54,36,8.4722222222,9,6,6,2,2018-11-28 23:21:33,10,11,28,3652,304,3984
11012,11/28/2018 11:18:17 PM,Pesky holes,SAA100,3,3,9.3333333333,9,9,1,1,2018-11-28 23:18:17,10,11,28,3652,304,3984
11011,11/28/2018 11:09:24 PM,Looper,admwuic,1.91,23,7.0434782609,7,6,6,1,2018-11-28 23:09:24,10,11,28,3652,304,3984
11010,11/28/2018 10:51:30 PM,Fun_mania,cs_team,1.17,224,10.9196428571,11,8,44,7,2018-11-28 22:51:30,10,11,28,3652,304,3984
11009,11/28/2018 10:51:18 PM,Ship,CS_Team,1.9,18,7.9444444444,7,7,3,3,2018-11-28 22:51:18,10,11,28,3652,304,3984
11008,11/28/2018 10:03:32 PM,Iteration,FESP200,1.07,45,4.2444444444,4,4,5,10,2018-11-28 22:03:32,10,11,28,3652,304,3984
11007,11/28/2018 8:52:36 PM,Do It Right,aja2718,3,12,7.8333333333,8,7,5,1,2018-11-28 20:52:36,10,11,28,3652,304,3984
11006,11/28/2018 8:24:11 PM,Mirror_Image_Sort_of,RaphDevaTaeh,1.8,21,6,6,6,4,2,2018-11-28 20:24:11,10,11,28,3652,304,3984
11004,11/28/2018 6:56:37 PM,UIC_ENGR_100,KrustyCrew,1.62,33,5,5,5,8,3,2018-11-28 18:56:37,10,11,28,3652,304,3984
11003,11/28/2018 5:57:11 PM,Color turn selection,fespBois,2.33,16,13.1875,14,11,6,0,2018-11-28 17:57:11,10,11,28,3652,304,3984
11002,11/28/2018 5:56:08 PM,Stack & Sweep,axorion,3.5,4,23,23,23,2,0,2018-11-28 17:56:08,10,11,28,3652,304,3984
11001,11/28/2018 5:49:58 PM,Spiral Stairs,FESP200,2.3,19,12.6315789474,17,8,3,1,2018-11-28 17:49:58,10,11,28,3652,304,3984
11000,11/28/2018 5:43:44 PM,Color Selection,fespBois,1.21,89,5,5,5,14,8,2018-11-28 17:43:44,10,11,28,3652,304,3984
10999,11/28/2018 5:33:49 PM,Conditions,fespBois,1.75,31,6.1935483871,5,5,4,2,2018-11-28 17:33:49,10,11,28,3652,304,3984
10998,11/28/2018 5:00:01 PM,Turn the L,UIC4,1.46,46,6.5869565217,6,6,8,2,2018-11-28 17:00:01,10,11,28,3652,304,3984
10997,11/28/2018 4:50:11 PM,Color Select,UIC4,1.41,76,6,6,6,10,6,2018-11-28 16:50:11,10,11,28,3652,304,3984
10996,11/28/2018 4:35:24 PM,function calls,uiceng100,1.5,40,12.05,10,10,6,4,2018-11-28 16:35:24,10,11,28,3652,304,3984
10995,11/28/2018 4:30:54 PM,iteration,uiceng100,1.4,38,4,4,4,3,8,2018-11-28 16:30:54,10,11,28,3652,304,3984
10994,11/28/2018 4:23:00 PM,selection,uiceng100,1.54,32,9.5,9,9,5,4,2018-11-28 16:23:00,10,11,28,3652,304,3984
10993,11/28/2018 2:41:30 PM,Delayed Reaction,candyapples,1.89,19,9.0526315789,9,9,4,1,2018-11-28 14:41:30,10,11,28,3652,304,3984
10992,11/28/2018 2:24:04 PM,Blue Pac-Man,CandyApples,1.64,40,11.825,13,7,10,0,2018-11-28 14:24:04,10,11,28,3652,304,3984
10991,11/28/2018 12:32:33 PM,Follow the trail,ZorkonZorba,1.71,22,19.7272727273,21,10,2,3,2018-11-28 12:32:33,10,11,28,3652,304,3984
10990,11/28/2018 12:02:56 PM,"Selection, Iteration, and Function calls!",ZorkonZorba,1.75,29,11.5172413793,13,8,4,1,2018-11-28 12:02:56,10,11,28,3652,304,3984
10989,11/28/2018 11:58:14 AM,Funksions,WASFaccount,1.88,16,17.875,17,12,4,1,2018-11-28 11:58:14,10,11,28,3652,304,3984
10988,11/28/2018 11:37:29 AM,Replication Engine 13,drmazhar,3.5,5,25,25,25,1,0,2018-11-28 11:37:29,10,11,28,3652,304,3984
10987,11/28/2018 11:28:01 AM,Around the ddge,WASFaccount,1.5,36,8.1388888889,8,8,4,2,2018-11-28 11:28:01,10,11,28,3652,304,3984
10986,11/28/2018 10:07:15 AM,Stacknester,jnpollack,3.17,7,20.2857142857,22,16,4,0,2018-11-28 10:07:15,10,11,28,3652,304,3984
10985,11/28/2018 9:31:29 AM,Iteration + Function Calls + Selection,fespBois,1.9,21,12.1904761905,11,10,5,2,2018-11-28 09:31:29,10,11,28,3652,304,3984
10984,11/28/2018 9:06:04 AM,Selection + Function Calls,fespBois,2.25,17,7.1176470588,8,6,6,1,2018-11-28 09:06:04,10,11,28,3652,304,3984
10983,11/28/2018 8:19:18 AM,Stairway to...,psef2018,1.25,65,9.6461538462,9,9,8,2,2018-11-28 08:19:18,10,11,28,3652,304,3984
10981,11/28/2018 4:42:26 AM,Iteration,KSJBJKNN,3,8,18.375,22,15,3,0,2018-11-28 04:42:26,10,11,28,3652,304,3984
10980,11/28/2018 12:10:37 AM,SELECTION,uiceng100,1.15,229,4.2576419214,4,4,34,20,2018-11-28 00:10:37,10,11,28,3652,304,3984
10979,11/27/2018 11:08:11 PM,Selection,KSJBJKNN,2.5,11,13.4545454545,12,8,2,3,2018-11-27 23:08:11,10,11,27,3652,304,3983
10976,11/27/2018 8:37:06 PM,Woot,WASFaccount,1.9,21,6,5,5,6,0,2018-11-27 20:37:06,10,11,27,3652,304,3983
10975,11/27/2018 6:39:52 PM,Function Calls & Loops,j3s1,1.75,29,6.8965517241,0,4,4,3,2018-11-27 18:39:52,10,11,27,3652,304,3983
10974,11/27/2018 5:56:25 PM,ITERATION,WASFaccount,1.29,73,10,10,10,8,4,2018-11-27 17:56:25,10,11,27,3652,304,3983
10973,11/27/2018 5:51:10 PM,function and iteration,Potato2_0,1.17,197,10.2791878173,8,8,41,7,2018-11-27 17:51:10,10,11,27,3652,304,3983
10972,11/27/2018 5:42:40 PM,Drifting,ashkaypao,2.14,12,15.5,13,10,4,2,2018-11-27 17:42:40,10,11,27,3652,304,3983
10971,11/27/2018 5:41:55 PM,Challenge 1,groupproject_1,1.6,28,14.6428571429,14,10,6,2,2018-11-27 17:41:55,10,11,27,3652,304,3983
10970,11/27/2018 5:41:06 PM,selection,Potato2_0,1.24,165,4.3636363636,4,4,23,13,2018-11-27 17:41:06,10,11,27,3652,304,3983
10969,11/27/2018 5:37:18 PM,More Complex,SAA100,2.5,9,9.6666666667,11,7,3,1,2018-11-27 17:37:18,10,11,27,3652,304,3983
10968,11/27/2018 5:33:21 PM,function and selection,Potato2_0,1.26,96,7.4479166667,7,6,12,6,2018-11-27 17:33:21,10,11,27,3652,304,3983
10967,11/27/2018 5:28:55 PM,function,Potato2_0,1.34,245,7.5591836735,8,6,48,11,2018-11-27 17:28:55,10,11,27,3652,304,3983
10966,11/27/2018 5:25:14 PM,Function,groupproject_1,1.5,35,10.2285714286,7,6,7,3,2018-11-27 17:25:14,10,11,27,3652,304,3983
10965,11/27/2018 5:23:53 PM,Weird Calls,UIC4,1.23,103,5.2912621359,5,5,22,7,2018-11-27 17:23:53,10,11,27,3652,304,3983
10964,11/27/2018 5:21:31 PM,CS-111 - Combo,groupproject_1,1.38,46,14.7826086957,0,10,5,4,2018-11-27 17:21:31,10,11,27,3652,304,3983
10963,11/27/2018 5:16:01 PM,iteration,Potato2_0,1.7,25,12.52,12,12,4,3,2018-11-27 17:16:01,10,11,27,3652,304,3983
10962,11/27/2018 5:15:37 PM,A combination of selection and functions,groupproject_1,2,16,13.75,16,9,4,4,2018-11-27 17:15:37,10,11,27,3652,304,3983
10961,11/27/2018 5:10:36 PM,<PLAINTEXT>,ayylmao,1.29,65,5.6923076923,5,5,8,7,2018-11-27 17:10:36,10,11,27,3652,304,3983
10960,11/27/2018 5:02:04 PM,Call It Right,ashkaypao,2,12,19.1666666667,14,14,2,3,2018-11-27 17:02:04,10,11,27,3652,304,3983
10959,11/27/2018 4:58:41 PM,A focus on selection,groupproject_1,1.29,71,6.5211267606,6,6,9,9,2018-11-27 16:58:41,10,11,27,3652,304,3983
10958,11/27/2018 4:55:20 PM,In and Out,uiccs2018,1.78,21,11.2857142857,10,8,4,3,2018-11-27 16:55:20,10,11,27,3652,304,3983
10957,11/27/2018 4:42:29 PM,Kebob,uiccs2018,2.22,14,11.2857142857,13,8,4,0,2018-11-27 16:42:29,10,11,27,3652,304,3983
10951,11/27/2018 4:10:30 PM,Challenge Puzzle,ashkaypao,1.6,80,15.025,17,6,2,4,2018-11-27 16:10:30,10,11,27,3652,304,3983
10950,11/27/2018 3:50:21 PM,Function,ashkaypao,1.88,18,15.0555555556,10,8,5,1,2018-11-27 15:50:21,10,11,27,3652,304,3983
10949,11/27/2018 3:21:39 PM,Stop and Go,gootipapa,2.83,12,19.5833333333,0,14,4,0,2018-11-27 15:21:39,10,11,27,3652,304,3983
10948,11/27/2018 3:18:50 PM,Iteration,ashkaypao,1.58,33,7,5,5,6,3,2018-11-27 15:18:50,10,11,27,3652,304,3983
10947,11/27/2018 3:11:37 PM,Combo Puzzle,FESP200,1.36,50,5.02,5,5,4,5,2018-11-27 15:11:37,10,11,27,3652,304,3983
10946,11/27/2018 2:36:47 PM,Weird Pathway,WASFaccount,1.55,30,12.8,11,11,4,3,2018-11-27 14:36:47,10,11,27,3652,304,3983
10945,11/27/2018 2:00:00 PM,tower,gootipapa,3,6,18.8333333333,21,15,2,1,2018-11-27 14:00:00,10,11,27,3652,304,3983
10944,11/27/2018 1:43:34 PM,smiley face,gootipapa,1.91,19,9.6842105263,8,7,4,2,2018-11-27 13:43:34,10,11,27,3652,304,3983
10943,11/27/2018 12:09:17 PM,Green problem,uic4,1.44,63,6.1746031746,6,6,8,6,2018-11-27 12:09:17,10,11,27,3652,304,3983
10942,11/27/2018 11:54:42 AM,red star,uic4,1.78,20,7,7,7,5,1,2018-11-27 11:54:42,10,11,27,3652,304,3983
10941,11/27/2018 2:51:05 AM,Athalia,Dancingpotato,1.33,55,5.5272727273,6,4,6,3,2018-11-27 02:51:05,10,11,27,3652,304,3983
10940,11/27/2018 2:49:13 AM,one more,Dancingpotato,1.25,120,7,0,6,18,7,2018-11-27 02:49:13,10,11,27,3652,304,3983
10939,11/27/2018 2:44:38 AM,kobe,Dancingpotato,1.17,172,7.023255814,8,6,30,7,2018-11-27 02:44:38,10,11,27,3652,304,3983
10938,11/27/2018 2:42:51 AM,sky,Dancingpotato,1.33,70,6.9142857143,6,6,10,5,2018-11-27 02:42:51,10,11,27,3652,304,3983
10937,11/27/2018 2:40:54 AM,eve,Dancingpotato,1.19,117,4.1452991453,4,4,13,13,2018-11-27 02:40:54,10,11,27,3652,304,3983
10936,11/27/2018 12:35:10 AM,Loop de Function,CS_ENGR100,2,17,7.4705882353,7,7,4,2,2018-11-27 00:35:10,10,11,27,3652,304,3983
10935,11/27/2018 12:13:49 AM,Turn and Turn,CS_ENGR100,1.41,73,7,7,7,14,5,2018-11-27 00:13:49,10,11,27,3652,304,3983
10934,11/26/2018 11:56:30 PM,Combo,CS_ENGR100,2.11,16,14.375,17,10,6,0,2018-11-26 23:56:30,10,11,26,3652,304,3982
10933,11/26/2018 10:52:10 PM,Fun Function,KMFS100,1.58,40,9.1,7,7,7,2,2018-11-26 22:52:10,10,11,26,3652,304,3982
10932,11/26/2018 10:28:43 PM,Figure 8,csproject20,1.46,35,8.9428571429,6,6,5,3,2018-11-26 22:28:43,10,11,26,3652,304,3982
10931,11/26/2018 9:32:53 PM,R stands for reverse,fespkv,1.38,45,7.0888888889,7,7,5,5,2018-11-26 21:32:53,10,11,26,3652,304,3982
10930,11/26/2018 9:06:34 PM,back and forth,fespkv,1.24,102,5,5,5,20,9,2018-11-26 21:06:34,10,11,26,3652,304,3982
10929,11/26/2018 8:57:04 PM,When will you turn left?,drmazhar,2.11,13,7,7,7,4,0,2018-11-26 20:57:04,10,11,26,3652,304,3982
10928,11/26/2018 1:59:29 PM,Iteration and function calls,robozzle01,1.89,18,16.6666666667,0,11,5,1,2018-11-26 13:59:29,10,11,26,3652,304,3982
10927,11/26/2018 1:20:09 PM,Pyramid Scheme,FESPKV,1.33,55,7.6,7,7,9,4,2018-11-26 13:20:09,10,11,26,3652,304,3982
10926,11/25/2018 8:34:45 PM,Look  for the Maximum,drmazhar,3.5,3,18,0,17,1,0,2018-11-25 20:34:45,10,11,25,3652,304,3981
10925,11/25/2018 8:02:29 PM,Look for the Minmum,drmazhar,3,4,22.25,19,19,1,0,2018-11-25 20:02:29,10,11,25,3652,304,3981
10924,11/25/2018 7:09:47 PM,Rejected,aja2718,2,20,9.8,10,9,9,1,2018-11-25 19:09:47,10,11,25,3652,304,3981
10923,11/25/2018 5:14:29 PM,Iteration,SAA100,2.1,16,9.8125,10,8,4,0,2018-11-25 17:14:29,10,11,25,3652,304,3981
10922,11/25/2018 4:53:28 PM,Turns,CS_ENGR100,2.11,15,13.0666666667,12,10,5,0,2018-11-25 16:53:28,10,11,25,3652,304,3981
10921,11/25/2018 4:05:12 PM,Select Wisely,csproject20,1.47,61,6.2459016393,5,5,11,4,2018-11-25 16:05:12,10,11,25,3652,304,3981
10920,11/25/2018 2:42:43 PM,Turn right on stars IV,jnpollack,4,2,10,10,10,0,0,2018-11-25 14:42:43,10,11,25,3652,304,3981
10919,11/25/2018 2:06:26 PM,How????,aja2718,3,8,6.25,6,6,3,1,2018-11-25 14:06:26,10,11,25,3652,304,3981
10918,11/25/2018 8:41:08 AM,"Cross, Don't Color, Center (REVISED)",aja2718,3,5,14.4,8,8,2,1,2018-11-25 08:41:08,10,11,25,3652,304,3981
10917,11/25/2018 8:05:00 AM,"Cross, Don't Color, Center",aja2718,3.2,6,16.3333333333,8,8,4,1,2018-11-25 08:05:00,10,11,25,3652,304,3981
10916,11/25/2018 1:22:57 AM,Divided Highway,axorion,3,2,14,14,14,1,0,2018-11-25 01:22:57,10,11,25,3652,304,3981
10915,11/24/2018 9:50:49 PM,Another one,dogWithnoLegs,1.75,33,11.3939393939,0,7,6,1,2018-11-24 21:50:49,10,11,24,3652,304,3980
10914,11/24/2018 9:43:24 PM,AdamT#2,dogWithnoLegs,1.92,26,10.7692307692,7,7,7,1,2018-11-24 21:43:24,10,11,24,3652,304,3980
10913,11/24/2018 9:30:04 PM,"Cross, Color, Center",aja2718,2.8,8,14.75,0,12,3,1,2018-11-24 21:30:04,10,11,24,3652,304,3980
10912,11/24/2018 7:02:31 PM,"Cross, Color, Center",aja2718,3,9,14.7777777778,0,12,3,1,2018-11-24 19:02:31,10,11,24,3652,304,3980
10911,11/24/2018 5:37:36 PM,Insect,FESPKV,1.88,18,16.9444444444,0,8,2,3,2018-11-24 17:37:36,10,11,24,3652,304,3980
10910,11/24/2018 4:37:15 PM,Iterations,FESPKV,2.5,9,18.4444444444,15,15,3,1,2018-11-24 16:37:15,10,11,24,3652,304,3980
10909,11/24/2018 2:44:03 PM,*function calls*,robozzle01,1.15,167,4,4,4,32,11,2018-11-24 14:44:03,10,11,24,3652,304,3980
10908,11/24/2018 11:42:22 AM,"Add One, Multiply By Two",aja2718,1.8,27,15.8518518519,16,15,5,3,2018-11-24 11:42:22,10,11,24,3652,304,3980
10907,11/24/2018 8:57:30 AM,Selection,psef2018,1.36,52,8.3461538462,9,6,5,4,2018-11-24 08:57:30,10,11,24,3652,304,3980
10906,11/24/2018 8:11:58 AM,Multiply by 2,aja2718,1.6,28,14.75,15,13,6,1,2018-11-24 08:11:58,10,11,24,3652,304,3980
10905,11/24/2018 1:08:25 AM,simple_snake_possible_combo,KMFS100,1.27,66,8.0303030303,8,7,7,3,2018-11-24 01:08:25,10,11,24,3652,304,3980
10904,11/24/2018 12:53:58 AM,Combo,KMFS100,1.26,89,5.0112359551,5,4,11,7,2018-11-24 00:53:58,10,11,24,3652,304,3980
10903,11/24/2018 12:07:57 AM,Iteration stairs,j3s1,1.86,22,8.1363636364,0,6,2,0,2018-11-24 00:07:57,10,11,24,3652,304,3980
10902,11/23/2018 10:27:35 PM,Function Calls,KrustyCrew,1.8,28,14.0714285714,15,9,8,0,2018-11-23 22:27:35,10,11,23,3652,304,3979
10901,11/23/2018 7:16:20 PM,Find the Relationship,aja2718,2.33,12,11.0833333333,11,11,5,1,2018-11-23 19:16:20,10,11,23,3652,304,3979
10900,11/23/2018 7:03:47 PM,Looks Simple II,aja2718,2.09,17,7,7,7,6,1,2018-11-23 19:03:47,10,11,23,3652,304,3979
10899,11/23/2018 6:57:08 PM,Looks Simple,aja2718,2.09,17,7,7,7,5,1,2018-11-23 18:57:08,10,11,23,3652,304,3979
